No.     Time           Source                Destination           Protocol Length Info
      1 0.000000       140.82.113.25         192.168.69.39         TLSv1.2  80     Application Data

Frame 1: 80 bytes on wire (640 bits), 80 bytes captured (640 bits) on interface \Device\NPF_{1315F7C5-5EA1-43CA-9087-EF19375CCA6A}, id 0
Ethernet II, Src: 1e:fd:96:3a:4d:31 (1e:fd:96:3a:4d:31), Dst: AzureWav_fc:e2:73 (dc:f5:05:fc:e2:73)
Internet Protocol Version 4, Src: 140.82.113.25, Dst: 192.168.69.39
Transmission Control Protocol, Src Port: 443, Dst Port: 53748, Seq: 1, Ack: 1, Len: 26
Transport Layer Security

No.     Time           Source                Destination           Protocol Length Info
      2 0.000742       192.168.69.39         140.82.113.25         TLSv1.2  84     Application Data

Frame 2: 84 bytes on wire (672 bits), 84 bytes captured (672 bits) on interface \Device\NPF_{1315F7C5-5EA1-43CA-9087-EF19375CCA6A}, id 0
Ethernet II, Src: AzureWav_fc:e2:73 (dc:f5:05:fc:e2:73), Dst: 1e:fd:96:3a:4d:31 (1e:fd:96:3a:4d:31)
Internet Protocol Version 4, Src: 192.168.69.39, Dst: 140.82.113.25
Transmission Control Protocol, Src Port: 53748, Dst Port: 443, Seq: 1, Ack: 27, Len: 30
Transport Layer Security

No.     Time           Source                Destination           Protocol Length Info
      3 0.511372       140.82.113.25         192.168.69.39         TCP      54     443 → 53748 [ACK] Seq=27 Ack=31 Win=70 Len=0

Frame 3: 54 bytes on wire (432 bits), 54 bytes captured (432 bits) on interface \Device\NPF_{1315F7C5-5EA1-43CA-9087-EF19375CCA6A}, id 0
Ethernet II, Src: 1e:fd:96:3a:4d:31 (1e:fd:96:3a:4d:31), Dst: AzureWav_fc:e2:73 (dc:f5:05:fc:e2:73)
Internet Protocol Version 4, Src: 140.82.113.25, Dst: 192.168.69.39
Transmission Control Protocol, Src Port: 443, Dst Port: 53748, Seq: 27, Ack: 31, Len: 0

No.     Time           Source                Destination           Protocol Length Info
      4 2.592852       192.168.69.39         20.210.169.67         TCP      54     53754 → 443 [RST, ACK] Seq=1 Ack=1 Win=0 Len=0

Frame 4: 54 bytes on wire (432 bits), 54 bytes captured (432 bits) on interface \Device\NPF_{1315F7C5-5EA1-43CA-9087-EF19375CCA6A}, id 0
Ethernet II, Src: AzureWav_fc:e2:73 (dc:f5:05:fc:e2:73), Dst: 1e:fd:96:3a:4d:31 (1e:fd:96:3a:4d:31)
Internet Protocol Version 4, Src: 192.168.69.39, Dst: 20.210.169.67
Transmission Control Protocol, Src Port: 53754, Dst Port: 443, Seq: 1, Ack: 1, Len: 0

No.     Time           Source                Destination           Protocol Length Info
      5 5.529104       1e:fd:96:3a:4d:31     AzureWav_fc:e2:73     ARP      42     Who has 192.168.69.39? Tell 192.168.69.80

Frame 5: 42 bytes on wire (336 bits), 42 bytes captured (336 bits) on interface \Device\NPF_{1315F7C5-5EA1-43CA-9087-EF19375CCA6A}, id 0
Ethernet II, Src: 1e:fd:96:3a:4d:31 (1e:fd:96:3a:4d:31), Dst: AzureWav_fc:e2:73 (dc:f5:05:fc:e2:73)
Address Resolution Protocol (request)

No.     Time           Source                Destination           Protocol Length Info
      6 5.529156       AzureWav_fc:e2:73     1e:fd:96:3a:4d:31     ARP      42     192.168.69.39 is at dc:f5:05:fc:e2:73

Frame 6: 42 bytes on wire (336 bits), 42 bytes captured (336 bits) on interface \Device\NPF_{1315F7C5-5EA1-43CA-9087-EF19375CCA6A}, id 0
Ethernet II, Src: AzureWav_fc:e2:73 (dc:f5:05:fc:e2:73), Dst: 1e:fd:96:3a:4d:31 (1e:fd:96:3a:4d:31)
Address Resolution Protocol (reply)

No.     Time           Source                Destination           Protocol Length Info
      7 10.955161      192.168.69.39         192.168.69.80         DNS      70     Standard query 0xba2d A github.com

Frame 7: 70 bytes on wire (560 bits), 70 bytes captured (560 bits) on interface \Device\NPF_{1315F7C5-5EA1-43CA-9087-EF19375CCA6A}, id 0
Ethernet II, Src: AzureWav_fc:e2:73 (dc:f5:05:fc:e2:73), Dst: 1e:fd:96:3a:4d:31 (1e:fd:96:3a:4d:31)
Internet Protocol Version 4, Src: 192.168.69.39, Dst: 192.168.69.80
User Datagram Protocol, Src Port: 58887, Dst Port: 53
Domain Name System (query)

No.     Time           Source                Destination           Protocol Length Info
      8 10.955455      192.168.69.39         192.168.69.80         DNS      70     Standard query 0xa33c AAAA github.com

Frame 8: 70 bytes on wire (560 bits), 70 bytes captured (560 bits) on interface \Device\NPF_{1315F7C5-5EA1-43CA-9087-EF19375CCA6A}, id 0
Ethernet II, Src: AzureWav_fc:e2:73 (dc:f5:05:fc:e2:73), Dst: 1e:fd:96:3a:4d:31 (1e:fd:96:3a:4d:31)
Internet Protocol Version 4, Src: 192.168.69.39, Dst: 192.168.69.80
User Datagram Protocol, Src Port: 52493, Dst Port: 53
Domain Name System (query)

No.     Time           Source                Destination           Protocol Length Info
      9 10.956033      192.168.69.39         192.168.69.80         DNS      70     Standard query 0xbb5c HTTPS github.com

Frame 9: 70 bytes on wire (560 bits), 70 bytes captured (560 bits) on interface \Device\NPF_{1315F7C5-5EA1-43CA-9087-EF19375CCA6A}, id 0
Ethernet II, Src: AzureWav_fc:e2:73 (dc:f5:05:fc:e2:73), Dst: 1e:fd:96:3a:4d:31 (1e:fd:96:3a:4d:31)
Internet Protocol Version 4, Src: 192.168.69.39, Dst: 192.168.69.80
User Datagram Protocol, Src Port: 53180, Dst Port: 53
Domain Name System (query)

No.     Time           Source                Destination           Protocol Length Info
     10 11.263605      192.168.69.80         192.168.69.39         DNS      70     Standard query response 0xa33c AAAA github.com

Frame 10: 70 bytes on wire (560 bits), 70 bytes captured (560 bits) on interface \Device\NPF_{1315F7C5-5EA1-43CA-9087-EF19375CCA6A}, id 0
Ethernet II, Src: 1e:fd:96:3a:4d:31 (1e:fd:96:3a:4d:31), Dst: AzureWav_fc:e2:73 (dc:f5:05:fc:e2:73)
Internet Protocol Version 4, Src: 192.168.69.80, Dst: 192.168.69.39
User Datagram Protocol, Src Port: 53, Dst Port: 52493
Domain Name System (response)

No.     Time           Source                Destination           Protocol Length Info
     11 11.264902      192.168.69.80         192.168.69.39         DNS      86     Standard query response 0xba2d A github.com A 20.207.73.82

Frame 11: 86 bytes on wire (688 bits), 86 bytes captured (688 bits) on interface \Device\NPF_{1315F7C5-5EA1-43CA-9087-EF19375CCA6A}, id 0
Ethernet II, Src: 1e:fd:96:3a:4d:31 (1e:fd:96:3a:4d:31), Dst: AzureWav_fc:e2:73 (dc:f5:05:fc:e2:73)
Internet Protocol Version 4, Src: 192.168.69.80, Dst: 192.168.69.39
User Datagram Protocol, Src Port: 53, Dst Port: 58887
Domain Name System (response)

No.     Time           Source                Destination           Protocol Length Info
     12 11.264902      192.168.69.80         192.168.69.39         DNS      154    Standard query response 0xbb5c HTTPS github.com SOA ns-1707.awsdns-21.co.uk

Frame 12: 154 bytes on wire (1232 bits), 154 bytes captured (1232 bits) on interface \Device\NPF_{1315F7C5-5EA1-43CA-9087-EF19375CCA6A}, id 0
Ethernet II, Src: 1e:fd:96:3a:4d:31 (1e:fd:96:3a:4d:31), Dst: AzureWav_fc:e2:73 (dc:f5:05:fc:e2:73)
Internet Protocol Version 4, Src: 192.168.69.80, Dst: 192.168.69.39
User Datagram Protocol, Src Port: 53, Dst Port: 53180
Domain Name System (response)

No.     Time           Source                Destination           Protocol Length Info
     13 11.266898      192.168.69.39         20.207.73.82          TCP      66     53755 → 443 [SYN] Seq=0 Win=64240 Len=0 MSS=1460 WS=256 SACK_PERM

Frame 13: 66 bytes on wire (528 bits), 66 bytes captured (528 bits) on interface \Device\NPF_{1315F7C5-5EA1-43CA-9087-EF19375CCA6A}, id 0
Ethernet II, Src: AzureWav_fc:e2:73 (dc:f5:05:fc:e2:73), Dst: 1e:fd:96:3a:4d:31 (1e:fd:96:3a:4d:31)
Internet Protocol Version 4, Src: 192.168.69.39, Dst: 20.207.73.82
Transmission Control Protocol, Src Port: 53755, Dst Port: 443, Seq: 0, Len: 0

No.     Time           Source                Destination           Protocol Length Info
     14 11.345763      20.207.73.82          192.168.69.39         TCP      66     443 → 53755 [SYN, ACK] Seq=0 Ack=1 Win=65535 Len=0 MSS=1318 SACK_PERM WS=1024

Frame 14: 66 bytes on wire (528 bits), 66 bytes captured (528 bits) on interface \Device\NPF_{1315F7C5-5EA1-43CA-9087-EF19375CCA6A}, id 0
Ethernet II, Src: 1e:fd:96:3a:4d:31 (1e:fd:96:3a:4d:31), Dst: AzureWav_fc:e2:73 (dc:f5:05:fc:e2:73)
Internet Protocol Version 4, Src: 20.207.73.82, Dst: 192.168.69.39
Transmission Control Protocol, Src Port: 443, Dst Port: 53755, Seq: 0, Ack: 1, Len: 0

No.     Time           Source                Destination           Protocol Length Info
     15 11.346052      192.168.69.39         20.207.73.82          TCP      54     53755 → 443 [ACK] Seq=1 Ack=1 Win=65792 Len=0

Frame 15: 54 bytes on wire (432 bits), 54 bytes captured (432 bits) on interface \Device\NPF_{1315F7C5-5EA1-43CA-9087-EF19375CCA6A}, id 0
Ethernet II, Src: AzureWav_fc:e2:73 (dc:f5:05:fc:e2:73), Dst: 1e:fd:96:3a:4d:31 (1e:fd:96:3a:4d:31)
Internet Protocol Version 4, Src: 192.168.69.39, Dst: 20.207.73.82
Transmission Control Protocol, Src Port: 53755, Dst Port: 443, Seq: 1, Ack: 1, Len: 0

No.     Time           Source                Destination           Protocol Length Info
     16 11.347840      192.168.69.39         20.207.73.82          TLSv1.3  571    Client Hello

Frame 16: 571 bytes on wire (4568 bits), 571 bytes captured (4568 bits) on interface \Device\NPF_{1315F7C5-5EA1-43CA-9087-EF19375CCA6A}, id 0
Ethernet II, Src: AzureWav_fc:e2:73 (dc:f5:05:fc:e2:73), Dst: 1e:fd:96:3a:4d:31 (1e:fd:96:3a:4d:31)
Internet Protocol Version 4, Src: 192.168.69.39, Dst: 20.207.73.82
Transmission Control Protocol, Src Port: 53755, Dst Port: 443, Seq: 1, Ack: 1, Len: 517
Transport Layer Security

No.     Time           Source                Destination           Protocol Length Info
     17 11.420804      20.207.73.82          192.168.69.39         TLSv1.3  1372   Server Hello, Change Cipher Spec, Application Data

Frame 17: 1372 bytes on wire (10976 bits), 1372 bytes captured (10976 bits) on interface \Device\NPF_{1315F7C5-5EA1-43CA-9087-EF19375CCA6A}, id 0
Ethernet II, Src: 1e:fd:96:3a:4d:31 (1e:fd:96:3a:4d:31), Dst: AzureWav_fc:e2:73 (dc:f5:05:fc:e2:73)
Internet Protocol Version 4, Src: 20.207.73.82, Dst: 192.168.69.39
Transmission Control Protocol, Src Port: 443, Dst Port: 53755, Seq: 1, Ack: 518, Len: 1318
Transport Layer Security

No.     Time           Source                Destination           Protocol Length Info
     18 11.420804      20.207.73.82          192.168.69.39         TCP      1372   443 → 53755 [ACK] Seq=1319 Ack=518 Win=67584 Len=1318 [TCP segment of a reassembled PDU]

Frame 18: 1372 bytes on wire (10976 bits), 1372 bytes captured (10976 bits) on interface \Device\NPF_{1315F7C5-5EA1-43CA-9087-EF19375CCA6A}, id 0
Ethernet II, Src: 1e:fd:96:3a:4d:31 (1e:fd:96:3a:4d:31), Dst: AzureWav_fc:e2:73 (dc:f5:05:fc:e2:73)
Internet Protocol Version 4, Src: 20.207.73.82, Dst: 192.168.69.39
Transmission Control Protocol, Src Port: 443, Dst Port: 53755, Seq: 1319, Ack: 518, Len: 1318

No.     Time           Source                Destination           Protocol Length Info
     19 11.420804      20.207.73.82          192.168.69.39         TLSv1.3  231    Application Data, Application Data, Application Data

Frame 19: 231 bytes on wire (1848 bits), 231 bytes captured (1848 bits) on interface \Device\NPF_{1315F7C5-5EA1-43CA-9087-EF19375CCA6A}, id 0
Ethernet II, Src: 1e:fd:96:3a:4d:31 (1e:fd:96:3a:4d:31), Dst: AzureWav_fc:e2:73 (dc:f5:05:fc:e2:73)
Internet Protocol Version 4, Src: 20.207.73.82, Dst: 192.168.69.39
Transmission Control Protocol, Src Port: 443, Dst Port: 53755, Seq: 2637, Ack: 518, Len: 177
[3 Reassembled TCP Segments (2481 bytes): #17(1144), #18(1318), #19(19)]
Transport Layer Security
Transport Layer Security

No.     Time           Source                Destination           Protocol Length Info
     20 11.421098      192.168.69.39         20.207.73.82          TCP      54     53755 → 443 [ACK] Seq=518 Ack=2814 Win=65792 Len=0

Frame 20: 54 bytes on wire (432 bits), 54 bytes captured (432 bits) on interface \Device\NPF_{1315F7C5-5EA1-43CA-9087-EF19375CCA6A}, id 0
Ethernet II, Src: AzureWav_fc:e2:73 (dc:f5:05:fc:e2:73), Dst: 1e:fd:96:3a:4d:31 (1e:fd:96:3a:4d:31)
Internet Protocol Version 4, Src: 192.168.69.39, Dst: 20.207.73.82
Transmission Control Protocol, Src Port: 53755, Dst Port: 443, Seq: 518, Ack: 2814, Len: 0

No.     Time           Source                Destination           Protocol Length Info
     21 11.423650      192.168.69.39         20.207.73.82          TLSv1.3  118    Change Cipher Spec, Application Data

Frame 21: 118 bytes on wire (944 bits), 118 bytes captured (944 bits) on interface \Device\NPF_{1315F7C5-5EA1-43CA-9087-EF19375CCA6A}, id 0
Ethernet II, Src: AzureWav_fc:e2:73 (dc:f5:05:fc:e2:73), Dst: 1e:fd:96:3a:4d:31 (1e:fd:96:3a:4d:31)
Internet Protocol Version 4, Src: 192.168.69.39, Dst: 20.207.73.82
Transmission Control Protocol, Src Port: 53755, Dst Port: 443, Seq: 518, Ack: 2814, Len: 64
Transport Layer Security

No.     Time           Source                Destination           Protocol Length Info
     22 11.424308      192.168.69.39         20.207.73.82          TLSv1.3  152    Application Data

Frame 22: 152 bytes on wire (1216 bits), 152 bytes captured (1216 bits) on interface \Device\NPF_{1315F7C5-5EA1-43CA-9087-EF19375CCA6A}, id 0
Ethernet II, Src: AzureWav_fc:e2:73 (dc:f5:05:fc:e2:73), Dst: 1e:fd:96:3a:4d:31 (1e:fd:96:3a:4d:31)
Internet Protocol Version 4, Src: 192.168.69.39, Dst: 20.207.73.82
Transmission Control Protocol, Src Port: 53755, Dst Port: 443, Seq: 582, Ack: 2814, Len: 98
Transport Layer Security

No.     Time           Source                Destination           Protocol Length Info
     23 11.425297      192.168.69.39         20.207.73.82          TCP      1372   53755 → 443 [ACK] Seq=680 Ack=2814 Win=65792 Len=1318 [TCP segment of a reassembled PDU]

Frame 23: 1372 bytes on wire (10976 bits), 1372 bytes captured (10976 bits) on interface \Device\NPF_{1315F7C5-5EA1-43CA-9087-EF19375CCA6A}, id 0
Ethernet II, Src: AzureWav_fc:e2:73 (dc:f5:05:fc:e2:73), Dst: 1e:fd:96:3a:4d:31 (1e:fd:96:3a:4d:31)
Internet Protocol Version 4, Src: 192.168.69.39, Dst: 20.207.73.82
Transmission Control Protocol, Src Port: 53755, Dst Port: 443, Seq: 680, Ack: 2814, Len: 1318

No.     Time           Source                Destination           Protocol Length Info
     24 11.425297      192.168.69.39         20.207.73.82          TLSv1.3  412    Application Data

Frame 24: 412 bytes on wire (3296 bits), 412 bytes captured (3296 bits) on interface \Device\NPF_{1315F7C5-5EA1-43CA-9087-EF19375CCA6A}, id 0
Ethernet II, Src: AzureWav_fc:e2:73 (dc:f5:05:fc:e2:73), Dst: 1e:fd:96:3a:4d:31 (1e:fd:96:3a:4d:31)
Internet Protocol Version 4, Src: 192.168.69.39, Dst: 20.207.73.82
Transmission Control Protocol, Src Port: 53755, Dst Port: 443, Seq: 1998, Ack: 2814, Len: 358
[2 Reassembled TCP Segments (1676 bytes): #23(1318), #24(358)]
Transport Layer Security

No.     Time           Source                Destination           Protocol Length Info
     25 11.527890      20.207.73.82          192.168.69.39         TLSv1.3  133    Application Data

Frame 25: 133 bytes on wire (1064 bits), 133 bytes captured (1064 bits) on interface \Device\NPF_{1315F7C5-5EA1-43CA-9087-EF19375CCA6A}, id 0
Ethernet II, Src: 1e:fd:96:3a:4d:31 (1e:fd:96:3a:4d:31), Dst: AzureWav_fc:e2:73 (dc:f5:05:fc:e2:73)
Internet Protocol Version 4, Src: 20.207.73.82, Dst: 192.168.69.39
Transmission Control Protocol, Src Port: 443, Dst Port: 53755, Seq: 2814, Ack: 582, Len: 79
Transport Layer Security

No.     Time           Source                Destination           Protocol Length Info
     26 11.527890      20.207.73.82          192.168.69.39         TLSv1.3  133    Application Data

Frame 26: 133 bytes on wire (1064 bits), 133 bytes captured (1064 bits) on interface \Device\NPF_{1315F7C5-5EA1-43CA-9087-EF19375CCA6A}, id 0
Ethernet II, Src: 1e:fd:96:3a:4d:31 (1e:fd:96:3a:4d:31), Dst: AzureWav_fc:e2:73 (dc:f5:05:fc:e2:73)
Internet Protocol Version 4, Src: 20.207.73.82, Dst: 192.168.69.39
Transmission Control Protocol, Src Port: 443, Dst Port: 53755, Seq: 2893, Ack: 680, Len: 79
Transport Layer Security

No.     Time           Source                Destination           Protocol Length Info
     27 11.528082      192.168.69.39         20.207.73.82          TCP      54     53755 → 443 [ACK] Seq=2356 Ack=2972 Win=65536 Len=0

Frame 27: 54 bytes on wire (432 bits), 54 bytes captured (432 bits) on interface \Device\NPF_{1315F7C5-5EA1-43CA-9087-EF19375CCA6A}, id 0
Ethernet II, Src: AzureWav_fc:e2:73 (dc:f5:05:fc:e2:73), Dst: 1e:fd:96:3a:4d:31 (1e:fd:96:3a:4d:31)
Internet Protocol Version 4, Src: 192.168.69.39, Dst: 20.207.73.82
Transmission Control Protocol, Src Port: 53755, Dst Port: 443, Seq: 2356, Ack: 2972, Len: 0

No.     Time           Source                Destination           Protocol Length Info
     28 11.528816      20.207.73.82          192.168.69.39         TCP      54     443 → 53755 [ACK] Seq=2972 Ack=2356 Win=70656 Len=0

Frame 28: 54 bytes on wire (432 bits), 54 bytes captured (432 bits) on interface \Device\NPF_{1315F7C5-5EA1-43CA-9087-EF19375CCA6A}, id 0
Ethernet II, Src: 1e:fd:96:3a:4d:31 (1e:fd:96:3a:4d:31), Dst: AzureWav_fc:e2:73 (dc:f5:05:fc:e2:73)
Internet Protocol Version 4, Src: 20.207.73.82, Dst: 192.168.69.39
Transmission Control Protocol, Src Port: 443, Dst Port: 53755, Seq: 2972, Ack: 2356, Len: 0

No.     Time           Source                Destination           Protocol Length Info
     29 11.528816      20.207.73.82          192.168.69.39         TLSv1.3  118    Application Data

Frame 29: 118 bytes on wire (944 bits), 118 bytes captured (944 bits) on interface \Device\NPF_{1315F7C5-5EA1-43CA-9087-EF19375CCA6A}, id 0
Ethernet II, Src: 1e:fd:96:3a:4d:31 (1e:fd:96:3a:4d:31), Dst: AzureWav_fc:e2:73 (dc:f5:05:fc:e2:73)
Internet Protocol Version 4, Src: 20.207.73.82, Dst: 192.168.69.39
Transmission Control Protocol, Src Port: 443, Dst Port: 53755, Seq: 2972, Ack: 2356, Len: 64
Transport Layer Security

No.     Time           Source                Destination           Protocol Length Info
     30 11.529592      192.168.69.39         20.207.73.82          TLSv1.3  85     Application Data

Frame 30: 85 bytes on wire (680 bits), 85 bytes captured (680 bits) on interface \Device\NPF_{1315F7C5-5EA1-43CA-9087-EF19375CCA6A}, id 0
Ethernet II, Src: AzureWav_fc:e2:73 (dc:f5:05:fc:e2:73), Dst: 1e:fd:96:3a:4d:31 (1e:fd:96:3a:4d:31)
Internet Protocol Version 4, Src: 192.168.69.39, Dst: 20.207.73.82
Transmission Control Protocol, Src Port: 53755, Dst Port: 443, Seq: 2356, Ack: 3036, Len: 31
Transport Layer Security

No.     Time           Source                Destination           Protocol Length Info
     31 11.678312      20.207.73.82          192.168.69.39         TCP      54     443 → 53755 [ACK] Seq=3036 Ack=2387 Win=70656 Len=0

Frame 31: 54 bytes on wire (432 bits), 54 bytes captured (432 bits) on interface \Device\NPF_{1315F7C5-5EA1-43CA-9087-EF19375CCA6A}, id 0
Ethernet II, Src: 1e:fd:96:3a:4d:31 (1e:fd:96:3a:4d:31), Dst: AzureWav_fc:e2:73 (dc:f5:05:fc:e2:73)
Internet Protocol Version 4, Src: 20.207.73.82, Dst: 192.168.69.39
Transmission Control Protocol, Src Port: 443, Dst Port: 53755, Seq: 3036, Ack: 2387, Len: 0

No.     Time           Source                Destination           Protocol Length Info
     32 11.979860      20.207.73.82          192.168.69.39         TCP      1372   443 → 53755 [ACK] Seq=3036 Ack=2387 Win=70656 Len=1318 [TCP segment of a reassembled PDU]

Frame 32: 1372 bytes on wire (10976 bits), 1372 bytes captured (10976 bits) on interface \Device\NPF_{1315F7C5-5EA1-43CA-9087-EF19375CCA6A}, id 0
Ethernet II, Src: 1e:fd:96:3a:4d:31 (1e:fd:96:3a:4d:31), Dst: AzureWav_fc:e2:73 (dc:f5:05:fc:e2:73)
Internet Protocol Version 4, Src: 20.207.73.82, Dst: 192.168.69.39
Transmission Control Protocol, Src Port: 443, Dst Port: 53755, Seq: 3036, Ack: 2387, Len: 1318

No.     Time           Source                Destination           Protocol Length Info
     33 11.979860      20.207.73.82          192.168.69.39         TLSv1.3  128    Application Data

Frame 33: 128 bytes on wire (1024 bits), 128 bytes captured (1024 bits) on interface \Device\NPF_{1315F7C5-5EA1-43CA-9087-EF19375CCA6A}, id 0
Ethernet II, Src: 1e:fd:96:3a:4d:31 (1e:fd:96:3a:4d:31), Dst: AzureWav_fc:e2:73 (dc:f5:05:fc:e2:73)
Internet Protocol Version 4, Src: 20.207.73.82, Dst: 192.168.69.39
Transmission Control Protocol, Src Port: 443, Dst Port: 53755, Seq: 4354, Ack: 2387, Len: 74
[2 Reassembled TCP Segments (1392 bytes): #32(1318), #33(74)]
Transport Layer Security

No.     Time           Source                Destination           Protocol Length Info
     34 11.980126      192.168.69.39         20.207.73.82          TCP      54     53755 → 443 [ACK] Seq=2387 Ack=4428 Win=65792 Len=0

Frame 34: 54 bytes on wire (432 bits), 54 bytes captured (432 bits) on interface \Device\NPF_{1315F7C5-5EA1-43CA-9087-EF19375CCA6A}, id 0
Ethernet II, Src: AzureWav_fc:e2:73 (dc:f5:05:fc:e2:73), Dst: 1e:fd:96:3a:4d:31 (1e:fd:96:3a:4d:31)
Internet Protocol Version 4, Src: 192.168.69.39, Dst: 20.207.73.82
Transmission Control Protocol, Src Port: 53755, Dst Port: 443, Seq: 2387, Ack: 4428, Len: 0

No.     Time           Source                Destination           Protocol Length Info
     35 11.980664      20.207.73.82          192.168.69.39         TCP      1372   443 → 53755 [ACK] Seq=4428 Ack=2387 Win=70656 Len=1318 [TCP segment of a reassembled PDU]

Frame 35: 1372 bytes on wire (10976 bits), 1372 bytes captured (10976 bits) on interface \Device\NPF_{1315F7C5-5EA1-43CA-9087-EF19375CCA6A}, id 0
Ethernet II, Src: 1e:fd:96:3a:4d:31 (1e:fd:96:3a:4d:31), Dst: AzureWav_fc:e2:73 (dc:f5:05:fc:e2:73)
Internet Protocol Version 4, Src: 20.207.73.82, Dst: 192.168.69.39
Transmission Control Protocol, Src Port: 443, Dst Port: 53755, Seq: 4428, Ack: 2387, Len: 1318

No.     Time           Source                Destination           Protocol Length Info
     36 11.980664      20.207.73.82          192.168.69.39         TLSv1.3  128    Application Data

Frame 36: 128 bytes on wire (1024 bits), 128 bytes captured (1024 bits) on interface \Device\NPF_{1315F7C5-5EA1-43CA-9087-EF19375CCA6A}, id 0
Ethernet II, Src: 1e:fd:96:3a:4d:31 (1e:fd:96:3a:4d:31), Dst: AzureWav_fc:e2:73 (dc:f5:05:fc:e2:73)
Internet Protocol Version 4, Src: 20.207.73.82, Dst: 192.168.69.39
Transmission Control Protocol, Src Port: 443, Dst Port: 53755, Seq: 5746, Ack: 2387, Len: 74
[2 Reassembled TCP Segments (1392 bytes): #35(1318), #36(74)]
Transport Layer Security

No.     Time           Source                Destination           Protocol Length Info
     37 11.980810      192.168.69.39         20.207.73.82          TCP      54     53755 → 443 [ACK] Seq=2387 Ack=5820 Win=65792 Len=0

Frame 37: 54 bytes on wire (432 bits), 54 bytes captured (432 bits) on interface \Device\NPF_{1315F7C5-5EA1-43CA-9087-EF19375CCA6A}, id 0
Ethernet II, Src: AzureWav_fc:e2:73 (dc:f5:05:fc:e2:73), Dst: 1e:fd:96:3a:4d:31 (1e:fd:96:3a:4d:31)
Internet Protocol Version 4, Src: 192.168.69.39, Dst: 20.207.73.82
Transmission Control Protocol, Src Port: 53755, Dst Port: 443, Seq: 2387, Ack: 5820, Len: 0

No.     Time           Source                Destination           Protocol Length Info
     38 11.982354      20.207.73.82          192.168.69.39         TCP      1372   443 → 53755 [ACK] Seq=5820 Ack=2387 Win=70656 Len=1318 [TCP segment of a reassembled PDU]

Frame 38: 1372 bytes on wire (10976 bits), 1372 bytes captured (10976 bits) on interface \Device\NPF_{1315F7C5-5EA1-43CA-9087-EF19375CCA6A}, id 0
Ethernet II, Src: 1e:fd:96:3a:4d:31 (1e:fd:96:3a:4d:31), Dst: AzureWav_fc:e2:73 (dc:f5:05:fc:e2:73)
Internet Protocol Version 4, Src: 20.207.73.82, Dst: 192.168.69.39
Transmission Control Protocol, Src Port: 443, Dst Port: 53755, Seq: 5820, Ack: 2387, Len: 1318

No.     Time           Source                Destination           Protocol Length Info
     39 11.982354      20.207.73.82          192.168.69.39         TLSv1.3  128    Application Data

Frame 39: 128 bytes on wire (1024 bits), 128 bytes captured (1024 bits) on interface \Device\NPF_{1315F7C5-5EA1-43CA-9087-EF19375CCA6A}, id 0
Ethernet II, Src: 1e:fd:96:3a:4d:31 (1e:fd:96:3a:4d:31), Dst: AzureWav_fc:e2:73 (dc:f5:05:fc:e2:73)
Internet Protocol Version 4, Src: 20.207.73.82, Dst: 192.168.69.39
Transmission Control Protocol, Src Port: 443, Dst Port: 53755, Seq: 7138, Ack: 2387, Len: 74
[2 Reassembled TCP Segments (1392 bytes): #38(1318), #39(74)]
Transport Layer Security

No.     Time           Source                Destination           Protocol Length Info
     40 11.982354      20.207.73.82          192.168.69.39         TCP      1372   443 → 53755 [ACK] Seq=7212 Ack=2387 Win=70656 Len=1318 [TCP segment of a reassembled PDU]

Frame 40: 1372 bytes on wire (10976 bits), 1372 bytes captured (10976 bits) on interface \Device\NPF_{1315F7C5-5EA1-43CA-9087-EF19375CCA6A}, id 0
Ethernet II, Src: 1e:fd:96:3a:4d:31 (1e:fd:96:3a:4d:31), Dst: AzureWav_fc:e2:73 (dc:f5:05:fc:e2:73)
Internet Protocol Version 4, Src: 20.207.73.82, Dst: 192.168.69.39
Transmission Control Protocol, Src Port: 443, Dst Port: 53755, Seq: 7212, Ack: 2387, Len: 1318

No.     Time           Source                Destination           Protocol Length Info
     41 11.982624      192.168.69.39         20.207.73.82          TCP      54     53755 → 443 [ACK] Seq=2387 Ack=8530 Win=65792 Len=0

Frame 41: 54 bytes on wire (432 bits), 54 bytes captured (432 bits) on interface \Device\NPF_{1315F7C5-5EA1-43CA-9087-EF19375CCA6A}, id 0
Ethernet II, Src: AzureWav_fc:e2:73 (dc:f5:05:fc:e2:73), Dst: 1e:fd:96:3a:4d:31 (1e:fd:96:3a:4d:31)
Internet Protocol Version 4, Src: 192.168.69.39, Dst: 20.207.73.82
Transmission Control Protocol, Src Port: 53755, Dst Port: 443, Seq: 2387, Ack: 8530, Len: 0

No.     Time           Source                Destination           Protocol Length Info
     42 11.982901      20.207.73.82          192.168.69.39         TLSv1.3  128    Application Data

Frame 42: 128 bytes on wire (1024 bits), 128 bytes captured (1024 bits) on interface \Device\NPF_{1315F7C5-5EA1-43CA-9087-EF19375CCA6A}, id 0
Ethernet II, Src: 1e:fd:96:3a:4d:31 (1e:fd:96:3a:4d:31), Dst: AzureWav_fc:e2:73 (dc:f5:05:fc:e2:73)
Internet Protocol Version 4, Src: 20.207.73.82, Dst: 192.168.69.39
Transmission Control Protocol, Src Port: 443, Dst Port: 53755, Seq: 8530, Ack: 2387, Len: 74
[2 Reassembled TCP Segments (1392 bytes): #40(1318), #42(74)]
Transport Layer Security

No.     Time           Source                Destination           Protocol Length Info
     43 11.983016      192.168.69.39         20.207.73.82          TCP      54     53755 → 443 [ACK] Seq=2387 Ack=8604 Win=65792 Len=0

Frame 43: 54 bytes on wire (432 bits), 54 bytes captured (432 bits) on interface \Device\NPF_{1315F7C5-5EA1-43CA-9087-EF19375CCA6A}, id 0
Ethernet II, Src: AzureWav_fc:e2:73 (dc:f5:05:fc:e2:73), Dst: 1e:fd:96:3a:4d:31 (1e:fd:96:3a:4d:31)
Internet Protocol Version 4, Src: 192.168.69.39, Dst: 20.207.73.82
Transmission Control Protocol, Src Port: 53755, Dst Port: 443, Seq: 2387, Ack: 8604, Len: 0

No.     Time           Source                Destination           Protocol Length Info
     44 11.983253      20.207.73.82          192.168.69.39         TCP      1372   443 → 53755 [ACK] Seq=8604 Ack=2387 Win=70656 Len=1318 [TCP segment of a reassembled PDU]

Frame 44: 1372 bytes on wire (10976 bits), 1372 bytes captured (10976 bits) on interface \Device\NPF_{1315F7C5-5EA1-43CA-9087-EF19375CCA6A}, id 0
Ethernet II, Src: 1e:fd:96:3a:4d:31 (1e:fd:96:3a:4d:31), Dst: AzureWav_fc:e2:73 (dc:f5:05:fc:e2:73)
Internet Protocol Version 4, Src: 20.207.73.82, Dst: 192.168.69.39
Transmission Control Protocol, Src Port: 443, Dst Port: 53755, Seq: 8604, Ack: 2387, Len: 1318

No.     Time           Source                Destination           Protocol Length Info
     45 11.983253      20.207.73.82          192.168.69.39         TLSv1.3  128    Application Data

Frame 45: 128 bytes on wire (1024 bits), 128 bytes captured (1024 bits) on interface \Device\NPF_{1315F7C5-5EA1-43CA-9087-EF19375CCA6A}, id 0
Ethernet II, Src: 1e:fd:96:3a:4d:31 (1e:fd:96:3a:4d:31), Dst: AzureWav_fc:e2:73 (dc:f5:05:fc:e2:73)
Internet Protocol Version 4, Src: 20.207.73.82, Dst: 192.168.69.39
Transmission Control Protocol, Src Port: 443, Dst Port: 53755, Seq: 9922, Ack: 2387, Len: 74
[2 Reassembled TCP Segments (1392 bytes): #44(1318), #45(74)]
Transport Layer Security

No.     Time           Source                Destination           Protocol Length Info
     46 11.983381      192.168.69.39         20.207.73.82          TCP      54     53755 → 443 [ACK] Seq=2387 Ack=9996 Win=65792 Len=0

Frame 46: 54 bytes on wire (432 bits), 54 bytes captured (432 bits) on interface \Device\NPF_{1315F7C5-5EA1-43CA-9087-EF19375CCA6A}, id 0
Ethernet II, Src: AzureWav_fc:e2:73 (dc:f5:05:fc:e2:73), Dst: 1e:fd:96:3a:4d:31 (1e:fd:96:3a:4d:31)
Internet Protocol Version 4, Src: 192.168.69.39, Dst: 20.207.73.82
Transmission Control Protocol, Src Port: 53755, Dst Port: 443, Seq: 2387, Ack: 9996, Len: 0

No.     Time           Source                Destination           Protocol Length Info
     47 12.042838      20.207.73.82          192.168.69.39         TCP      1372   443 → 53755 [ACK] Seq=9996 Ack=2387 Win=70656 Len=1318 [TCP segment of a reassembled PDU]

Frame 47: 1372 bytes on wire (10976 bits), 1372 bytes captured (10976 bits) on interface \Device\NPF_{1315F7C5-5EA1-43CA-9087-EF19375CCA6A}, id 0
Ethernet II, Src: 1e:fd:96:3a:4d:31 (1e:fd:96:3a:4d:31), Dst: AzureWav_fc:e2:73 (dc:f5:05:fc:e2:73)
Internet Protocol Version 4, Src: 20.207.73.82, Dst: 192.168.69.39
Transmission Control Protocol, Src Port: 443, Dst Port: 53755, Seq: 9996, Ack: 2387, Len: 1318

No.     Time           Source                Destination           Protocol Length Info
     48 12.042838      20.207.73.82          192.168.69.39         TLSv1.3  1372   Application Data

Frame 48: 1372 bytes on wire (10976 bits), 1372 bytes captured (10976 bits) on interface \Device\NPF_{1315F7C5-5EA1-43CA-9087-EF19375CCA6A}, id 0
Ethernet II, Src: 1e:fd:96:3a:4d:31 (1e:fd:96:3a:4d:31), Dst: AzureWav_fc:e2:73 (dc:f5:05:fc:e2:73)
Internet Protocol Version 4, Src: 20.207.73.82, Dst: 192.168.69.39
Transmission Control Protocol, Src Port: 443, Dst Port: 53755, Seq: 11314, Ack: 2387, Len: 1318
[2 Reassembled TCP Segments (1392 bytes): #47(1318), #48(74)]
Transport Layer Security

No.     Time           Source                Destination           Protocol Length Info
     49 12.043027      192.168.69.39         20.207.73.82          TCP      54     53755 → 443 [ACK] Seq=2387 Ack=12632 Win=65792 Len=0

Frame 49: 54 bytes on wire (432 bits), 54 bytes captured (432 bits) on interface \Device\NPF_{1315F7C5-5EA1-43CA-9087-EF19375CCA6A}, id 0
Ethernet II, Src: AzureWav_fc:e2:73 (dc:f5:05:fc:e2:73), Dst: 1e:fd:96:3a:4d:31 (1e:fd:96:3a:4d:31)
Internet Protocol Version 4, Src: 192.168.69.39, Dst: 20.207.73.82
Transmission Control Protocol, Src Port: 53755, Dst Port: 443, Seq: 2387, Ack: 12632, Len: 0

No.     Time           Source                Destination           Protocol Length Info
     50 12.046961      20.207.73.82          192.168.69.39         TLSv1.3  1372   Application Data

Frame 50: 1372 bytes on wire (10976 bits), 1372 bytes captured (10976 bits) on interface \Device\NPF_{1315F7C5-5EA1-43CA-9087-EF19375CCA6A}, id 0
Ethernet II, Src: 1e:fd:96:3a:4d:31 (1e:fd:96:3a:4d:31), Dst: AzureWav_fc:e2:73 (dc:f5:05:fc:e2:73)
Internet Protocol Version 4, Src: 20.207.73.82, Dst: 192.168.69.39
Transmission Control Protocol, Src Port: 443, Dst Port: 53755, Seq: 12632, Ack: 2387, Len: 1318
[2 Reassembled TCP Segments (1392 bytes): #48(1244), #50(148)]
Transport Layer Security

No.     Time           Source                Destination           Protocol Length Info
     51 12.046961      20.207.73.82          192.168.69.39         TLSv1.3  1372   Application Data

Frame 51: 1372 bytes on wire (10976 bits), 1372 bytes captured (10976 bits) on interface \Device\NPF_{1315F7C5-5EA1-43CA-9087-EF19375CCA6A}, id 0
Ethernet II, Src: 1e:fd:96:3a:4d:31 (1e:fd:96:3a:4d:31), Dst: AzureWav_fc:e2:73 (dc:f5:05:fc:e2:73)
Internet Protocol Version 4, Src: 20.207.73.82, Dst: 192.168.69.39
Transmission Control Protocol, Src Port: 443, Dst Port: 53755, Seq: 13950, Ack: 2387, Len: 1318
[2 Reassembled TCP Segments (1392 bytes): #50(1170), #51(222)]
Transport Layer Security

No.     Time           Source                Destination           Protocol Length Info
     52 12.047104      192.168.69.39         20.207.73.82          TCP      54     53755 → 443 [ACK] Seq=2387 Ack=15268 Win=65792 Len=0

Frame 52: 54 bytes on wire (432 bits), 54 bytes captured (432 bits) on interface \Device\NPF_{1315F7C5-5EA1-43CA-9087-EF19375CCA6A}, id 0
Ethernet II, Src: AzureWav_fc:e2:73 (dc:f5:05:fc:e2:73), Dst: 1e:fd:96:3a:4d:31 (1e:fd:96:3a:4d:31)
Internet Protocol Version 4, Src: 192.168.69.39, Dst: 20.207.73.82
Transmission Control Protocol, Src Port: 53755, Dst Port: 443, Seq: 2387, Ack: 15268, Len: 0

No.     Time           Source                Destination           Protocol Length Info
     53 12.047670      20.207.73.82          192.168.69.39         TLSv1.3  1372   Application Data

Frame 53: 1372 bytes on wire (10976 bits), 1372 bytes captured (10976 bits) on interface \Device\NPF_{1315F7C5-5EA1-43CA-9087-EF19375CCA6A}, id 0
Ethernet II, Src: 1e:fd:96:3a:4d:31 (1e:fd:96:3a:4d:31), Dst: AzureWav_fc:e2:73 (dc:f5:05:fc:e2:73)
Internet Protocol Version 4, Src: 20.207.73.82, Dst: 192.168.69.39
Transmission Control Protocol, Src Port: 443, Dst Port: 53755, Seq: 15268, Ack: 2387, Len: 1318
[2 Reassembled TCP Segments (1392 bytes): #51(1096), #53(296)]
Transport Layer Security

No.     Time           Source                Destination           Protocol Length Info
     54 12.047670      20.207.73.82          192.168.69.39         TLSv1.3  1372   Application Data

Frame 54: 1372 bytes on wire (10976 bits), 1372 bytes captured (10976 bits) on interface \Device\NPF_{1315F7C5-5EA1-43CA-9087-EF19375CCA6A}, id 0
Ethernet II, Src: 1e:fd:96:3a:4d:31 (1e:fd:96:3a:4d:31), Dst: AzureWav_fc:e2:73 (dc:f5:05:fc:e2:73)
Internet Protocol Version 4, Src: 20.207.73.82, Dst: 192.168.69.39
Transmission Control Protocol, Src Port: 443, Dst Port: 53755, Seq: 16586, Ack: 2387, Len: 1318
[2 Reassembled TCP Segments (1392 bytes): #53(1022), #54(370)]
Transport Layer Security

No.     Time           Source                Destination           Protocol Length Info
     55 12.047670      20.207.73.82          192.168.69.39         TLSv1.3  1372   Application Data

Frame 55: 1372 bytes on wire (10976 bits), 1372 bytes captured (10976 bits) on interface \Device\NPF_{1315F7C5-5EA1-43CA-9087-EF19375CCA6A}, id 0
Ethernet II, Src: 1e:fd:96:3a:4d:31 (1e:fd:96:3a:4d:31), Dst: AzureWav_fc:e2:73 (dc:f5:05:fc:e2:73)
Internet Protocol Version 4, Src: 20.207.73.82, Dst: 192.168.69.39
Transmission Control Protocol, Src Port: 443, Dst Port: 53755, Seq: 17904, Ack: 2387, Len: 1318
[2 Reassembled TCP Segments (1392 bytes): #54(948), #55(444)]
Transport Layer Security

No.     Time           Source                Destination           Protocol Length Info
     56 12.047670      20.207.73.82          192.168.69.39         TLSv1.3  1372   Application Data

Frame 56: 1372 bytes on wire (10976 bits), 1372 bytes captured (10976 bits) on interface \Device\NPF_{1315F7C5-5EA1-43CA-9087-EF19375CCA6A}, id 0
Ethernet II, Src: 1e:fd:96:3a:4d:31 (1e:fd:96:3a:4d:31), Dst: AzureWav_fc:e2:73 (dc:f5:05:fc:e2:73)
Internet Protocol Version 4, Src: 20.207.73.82, Dst: 192.168.69.39
Transmission Control Protocol, Src Port: 443, Dst Port: 53755, Seq: 19222, Ack: 2387, Len: 1318
[2 Reassembled TCP Segments (1392 bytes): #55(874), #56(518)]
Transport Layer Security

No.     Time           Source                Destination           Protocol Length Info
     57 12.047899      192.168.69.39         20.207.73.82          TCP      54     53755 → 443 [ACK] Seq=2387 Ack=20540 Win=65792 Len=0

Frame 57: 54 bytes on wire (432 bits), 54 bytes captured (432 bits) on interface \Device\NPF_{1315F7C5-5EA1-43CA-9087-EF19375CCA6A}, id 0
Ethernet II, Src: AzureWav_fc:e2:73 (dc:f5:05:fc:e2:73), Dst: 1e:fd:96:3a:4d:31 (1e:fd:96:3a:4d:31)
Internet Protocol Version 4, Src: 192.168.69.39, Dst: 20.207.73.82
Transmission Control Protocol, Src Port: 53755, Dst Port: 443, Seq: 2387, Ack: 20540, Len: 0

No.     Time           Source                Destination           Protocol Length Info
     58 12.049190      20.207.73.82          192.168.69.39         TLSv1.3  1372   Application Data

Frame 58: 1372 bytes on wire (10976 bits), 1372 bytes captured (10976 bits) on interface \Device\NPF_{1315F7C5-5EA1-43CA-9087-EF19375CCA6A}, id 0
Ethernet II, Src: 1e:fd:96:3a:4d:31 (1e:fd:96:3a:4d:31), Dst: AzureWav_fc:e2:73 (dc:f5:05:fc:e2:73)
Internet Protocol Version 4, Src: 20.207.73.82, Dst: 192.168.69.39
Transmission Control Protocol, Src Port: 443, Dst Port: 53755, Seq: 20540, Ack: 2387, Len: 1318
[2 Reassembled TCP Segments (1392 bytes): #56(800), #58(592)]
Transport Layer Security

No.     Time           Source                Destination           Protocol Length Info
     59 12.049752      20.207.73.82          192.168.69.39         TLSv1.3  1372   Application Data

Frame 59: 1372 bytes on wire (10976 bits), 1372 bytes captured (10976 bits) on interface \Device\NPF_{1315F7C5-5EA1-43CA-9087-EF19375CCA6A}, id 0
Ethernet II, Src: 1e:fd:96:3a:4d:31 (1e:fd:96:3a:4d:31), Dst: AzureWav_fc:e2:73 (dc:f5:05:fc:e2:73)
Internet Protocol Version 4, Src: 20.207.73.82, Dst: 192.168.69.39
Transmission Control Protocol, Src Port: 443, Dst Port: 53755, Seq: 21858, Ack: 2387, Len: 1318
[2 Reassembled TCP Segments (1392 bytes): #58(726), #59(666)]
Transport Layer Security

No.     Time           Source                Destination           Protocol Length Info
     60 12.049752      20.207.73.82          192.168.69.39         TLSv1.3  1372   Application Data

Frame 60: 1372 bytes on wire (10976 bits), 1372 bytes captured (10976 bits) on interface \Device\NPF_{1315F7C5-5EA1-43CA-9087-EF19375CCA6A}, id 0
Ethernet II, Src: 1e:fd:96:3a:4d:31 (1e:fd:96:3a:4d:31), Dst: AzureWav_fc:e2:73 (dc:f5:05:fc:e2:73)
Internet Protocol Version 4, Src: 20.207.73.82, Dst: 192.168.69.39
Transmission Control Protocol, Src Port: 443, Dst Port: 53755, Seq: 23176, Ack: 2387, Len: 1318
[2 Reassembled TCP Segments (1130 bytes): #59(652), #60(478)]
Transport Layer Security

No.     Time           Source                Destination           Protocol Length Info
     61 12.049900      192.168.69.39         20.207.73.82          TCP      54     53755 → 443 [ACK] Seq=2387 Ack=24494 Win=65792 Len=0

Frame 61: 54 bytes on wire (432 bits), 54 bytes captured (432 bits) on interface \Device\NPF_{1315F7C5-5EA1-43CA-9087-EF19375CCA6A}, id 0
Ethernet II, Src: AzureWav_fc:e2:73 (dc:f5:05:fc:e2:73), Dst: 1e:fd:96:3a:4d:31 (1e:fd:96:3a:4d:31)
Internet Protocol Version 4, Src: 192.168.69.39, Dst: 20.207.73.82
Transmission Control Protocol, Src Port: 53755, Dst Port: 443, Seq: 2387, Ack: 24494, Len: 0

No.     Time           Source                Destination           Protocol Length Info
     62 12.050077      20.207.73.82          192.168.69.39         TLSv1.3  1372   Application Data

Frame 62: 1372 bytes on wire (10976 bits), 1372 bytes captured (10976 bits) on interface \Device\NPF_{1315F7C5-5EA1-43CA-9087-EF19375CCA6A}, id 0
