No.     Time           Source                Destination           Protocol Length Info
      1 0.000000       192.168.69.39         239.255.255.250       SSDP     217    M-SEARCH * HTTP/1.1 

Frame 1: 217 bytes on wire (1736 bits), 217 bytes captured (1736 bits) on interface \Device\NPF_{1315F7C5-5EA1-43CA-9087-EF19375CCA6A}, id 0
Ethernet II, Src: AzureWav_fc:e2:73 (dc:f5:05:fc:e2:73), Dst: IPv4mcast_7f:ff:fa (01:00:5e:7f:ff:fa)
Internet Protocol Version 4, Src: 192.168.69.39, Dst: 239.255.255.250
User Datagram Protocol, Src Port: 61344, Dst Port: 1900
Simple Service Discovery Protocol

No.     Time           Source                Destination           Protocol Length Info
      2 1.009834       192.168.69.39         239.255.255.250       SSDP     217    M-SEARCH * HTTP/1.1 

Frame 2: 217 bytes on wire (1736 bits), 217 bytes captured (1736 bits) on interface \Device\NPF_{1315F7C5-5EA1-43CA-9087-EF19375CCA6A}, id 0
Ethernet II, Src: AzureWav_fc:e2:73 (dc:f5:05:fc:e2:73), Dst: IPv4mcast_7f:ff:fa (01:00:5e:7f:ff:fa)
Internet Protocol Version 4, Src: 192.168.69.39, Dst: 239.255.255.250
User Datagram Protocol, Src Port: 61344, Dst Port: 1900
Simple Service Discovery Protocol

No.     Time           Source                Destination           Protocol Length Info
      3 2.016113       192.168.69.39         239.255.255.250       SSDP     217    M-SEARCH * HTTP/1.1 

Frame 3: 217 bytes on wire (1736 bits), 217 bytes captured (1736 bits) on interface \Device\NPF_{1315F7C5-5EA1-43CA-9087-EF19375CCA6A}, id 0
Ethernet II, Src: AzureWav_fc:e2:73 (dc:f5:05:fc:e2:73), Dst: IPv4mcast_7f:ff:fa (01:00:5e:7f:ff:fa)
Internet Protocol Version 4, Src: 192.168.69.39, Dst: 239.255.255.250
User Datagram Protocol, Src Port: 61344, Dst Port: 1900
Simple Service Discovery Protocol

No.     Time           Source                Destination           Protocol Length Info
      4 3.021265       192.168.69.39         239.255.255.250       SSDP     217    M-SEARCH * HTTP/1.1 

Frame 4: 217 bytes on wire (1736 bits), 217 bytes captured (1736 bits) on interface \Device\NPF_{1315F7C5-5EA1-43CA-9087-EF19375CCA6A}, id 0
Ethernet II, Src: AzureWav_fc:e2:73 (dc:f5:05:fc:e2:73), Dst: IPv4mcast_7f:ff:fa (01:00:5e:7f:ff:fa)
Internet Protocol Version 4, Src: 192.168.69.39, Dst: 239.255.255.250
User Datagram Protocol, Src Port: 61344, Dst Port: 1900
Simple Service Discovery Protocol

No.     Time           Source                Destination           Protocol Length Info
      5 6.440022       192.168.69.39         140.82.113.25         TCP      55     53748 → 443 [ACK] Seq=1 Ack=1 Win=254 Len=1 [TCP segment of a reassembled PDU]

Frame 5: 55 bytes on wire (440 bits), 55 bytes captured (440 bits) on interface \Device\NPF_{1315F7C5-5EA1-43CA-9087-EF19375CCA6A}, id 0
Ethernet II, Src: AzureWav_fc:e2:73 (dc:f5:05:fc:e2:73), Dst: 1e:fd:96:3a:4d:31 (1e:fd:96:3a:4d:31)
Internet Protocol Version 4, Src: 192.168.69.39, Dst: 140.82.113.25
Transmission Control Protocol, Src Port: 53748, Dst Port: 443, Seq: 1, Ack: 1, Len: 1

No.     Time           Source                Destination           Protocol Length Info
      6 6.905667       140.82.113.25         192.168.69.39         TCP      66     443 → 53748 [ACK] Seq=1 Ack=2 Win=70 Len=0 SLE=1 SRE=2

Frame 6: 66 bytes on wire (528 bits), 66 bytes captured (528 bits) on interface \Device\NPF_{1315F7C5-5EA1-43CA-9087-EF19375CCA6A}, id 0
Ethernet II, Src: 1e:fd:96:3a:4d:31 (1e:fd:96:3a:4d:31), Dst: AzureWav_fc:e2:73 (dc:f5:05:fc:e2:73)
Internet Protocol Version 4, Src: 140.82.113.25, Dst: 192.168.69.39
Transmission Control Protocol, Src Port: 443, Dst Port: 53748, Seq: 1, Ack: 2, Len: 0

No.     Time           Source                Destination           Protocol Length Info
      7 11.505502      2404:6800:4009:827::200e 2401:4900:598a:b192:7cf7:cce2:285f:3518 TCP      74     443 → 53735 [FIN, ACK] Seq=1 Ack=1 Win=292 Len=0

Frame 7: 74 bytes on wire (592 bits), 74 bytes captured (592 bits) on interface \Device\NPF_{1315F7C5-5EA1-43CA-9087-EF19375CCA6A}, id 0
Ethernet II, Src: 1e:fd:96:3a:4d:31 (1e:fd:96:3a:4d:31), Dst: AzureWav_fc:e2:73 (dc:f5:05:fc:e2:73)
Internet Protocol Version 6, Src: 2404:6800:4009:827::200e, Dst: 2401:4900:598a:b192:7cf7:cce2:285f:3518
Transmission Control Protocol, Src Port: 443, Dst Port: 53735, Seq: 1, Ack: 1, Len: 0

No.     Time           Source                Destination           Protocol Length Info
      8 11.698281      192.168.69.39         20.207.73.85          TCP      55     53749 → 443 [ACK] Seq=1 Ack=1 Win=257 Len=1 [TCP segment of a reassembled PDU]

Frame 8: 55 bytes on wire (440 bits), 55 bytes captured (440 bits) on interface \Device\NPF_{1315F7C5-5EA1-43CA-9087-EF19375CCA6A}, id 0
Ethernet II, Src: AzureWav_fc:e2:73 (dc:f5:05:fc:e2:73), Dst: 1e:fd:96:3a:4d:31 (1e:fd:96:3a:4d:31)
Internet Protocol Version 4, Src: 192.168.69.39, Dst: 20.207.73.85
Transmission Control Protocol, Src Port: 53749, Dst Port: 443, Seq: 1, Ack: 1, Len: 1

No.     Time           Source                Destination           Protocol Length Info
      9 11.812841      20.207.73.85          192.168.69.39         TCP      66     443 → 53749 [ACK] Seq=1 Ack=2 Win=68 Len=0 SLE=1 SRE=2

Frame 9: 66 bytes on wire (528 bits), 66 bytes captured (528 bits) on interface \Device\NPF_{1315F7C5-5EA1-43CA-9087-EF19375CCA6A}, id 0
Ethernet II, Src: 1e:fd:96:3a:4d:31 (1e:fd:96:3a:4d:31), Dst: AzureWav_fc:e2:73 (dc:f5:05:fc:e2:73)
Internet Protocol Version 4, Src: 20.207.73.85, Dst: 192.168.69.39
Transmission Control Protocol, Src Port: 443, Dst Port: 53749, Seq: 1, Ack: 2, Len: 0

No.     Time           Source                Destination           Protocol Length Info
     10 11.932603      192.168.69.39         185.199.111.154       TCP      55     53692 → 443 [ACK] Seq=1 Ack=1 Win=1029 Len=1 [TCP segment of a reassembled PDU]

Frame 10: 55 bytes on wire (440 bits), 55 bytes captured (440 bits) on interface \Device\NPF_{1315F7C5-5EA1-43CA-9087-EF19375CCA6A}, id 0
Ethernet II, Src: AzureWav_fc:e2:73 (dc:f5:05:fc:e2:73), Dst: 1e:fd:96:3a:4d:31 (1e:fd:96:3a:4d:31)
Internet Protocol Version 4, Src: 192.168.69.39, Dst: 185.199.111.154
Transmission Control Protocol, Src Port: 53692, Dst Port: 443, Seq: 1, Ack: 1, Len: 1

No.     Time           Source                Destination           Protocol Length Info
     11 12.016550      1e:fd:96:3a:4d:31     AzureWav_fc:e2:73     ARP      42     Who has 192.168.69.39? Tell 192.168.69.80

Frame 11: 42 bytes on wire (336 bits), 42 bytes captured (336 bits) on interface \Device\NPF_{1315F7C5-5EA1-43CA-9087-EF19375CCA6A}, id 0
Ethernet II, Src: 1e:fd:96:3a:4d:31 (1e:fd:96:3a:4d:31), Dst: AzureWav_fc:e2:73 (dc:f5:05:fc:e2:73)
Address Resolution Protocol (request)

No.     Time           Source                Destination           Protocol Length Info
     12 12.016598      AzureWav_fc:e2:73     1e:fd:96:3a:4d:31     ARP      42     192.168.69.39 is at dc:f5:05:fc:e2:73

Frame 12: 42 bytes on wire (336 bits), 42 bytes captured (336 bits) on interface \Device\NPF_{1315F7C5-5EA1-43CA-9087-EF19375CCA6A}, id 0
Ethernet II, Src: AzureWav_fc:e2:73 (dc:f5:05:fc:e2:73), Dst: 1e:fd:96:3a:4d:31 (1e:fd:96:3a:4d:31)
Address Resolution Protocol (reply)

No.     Time           Source                Destination           Protocol Length Info
     13 12.080201      185.199.111.154       192.168.69.39         TCP      66     443 → 53692 [ACK] Seq=1 Ack=2 Win=288 Len=0 SLE=1 SRE=2

Frame 13: 66 bytes on wire (528 bits), 66 bytes captured (528 bits) on interface \Device\NPF_{1315F7C5-5EA1-43CA-9087-EF19375CCA6A}, id 0
Ethernet II, Src: 1e:fd:96:3a:4d:31 (1e:fd:96:3a:4d:31), Dst: AzureWav_fc:e2:73 (dc:f5:05:fc:e2:73)
Internet Protocol Version 4, Src: 185.199.111.154, Dst: 192.168.69.39
Transmission Control Protocol, Src Port: 443, Dst Port: 53692, Seq: 1, Ack: 2, Len: 0

No.     Time           Source                Destination           Protocol Length Info
     14 12.292041      2401:4900:598a:b192:7cf7:cce2:285f:3518 2606:50c0:8000::153   TCP      75     53718 → 443 [ACK] Seq=1 Ack=1 Win=1034 Len=1 [TCP segment of a reassembled PDU]

Frame 14: 75 bytes on wire (600 bits), 75 bytes captured (600 bits) on interface \Device\NPF_{1315F7C5-5EA1-43CA-9087-EF19375CCA6A}, id 0
Ethernet II, Src: AzureWav_fc:e2:73 (dc:f5:05:fc:e2:73), Dst: 1e:fd:96:3a:4d:31 (1e:fd:96:3a:4d:31)
Internet Protocol Version 6, Src: 2401:4900:598a:b192:7cf7:cce2:285f:3518, Dst: 2606:50c0:8000::153
Transmission Control Protocol, Src Port: 53718, Dst Port: 443, Seq: 1, Ack: 1, Len: 1

No.     Time           Source                Destination           Protocol Length Info
     15 12.384097      2606:50c0:8000::153   2401:4900:598a:b192:7cf7:cce2:285f:3518 TCP      86     443 → 53718 [ACK] Seq=1 Ack=2 Win=297 Len=0 SLE=1 SRE=2

Frame 15: 86 bytes on wire (688 bits), 86 bytes captured (688 bits) on interface \Device\NPF_{1315F7C5-5EA1-43CA-9087-EF19375CCA6A}, id 0
Ethernet II, Src: 1e:fd:96:3a:4d:31 (1e:fd:96:3a:4d:31), Dst: AzureWav_fc:e2:73 (dc:f5:05:fc:e2:73)
Internet Protocol Version 6, Src: 2606:50c0:8000::153, Dst: 2401:4900:598a:b192:7cf7:cce2:285f:3518
Transmission Control Protocol, Src Port: 443, Dst Port: 53718, Seq: 1, Ack: 2, Len: 0

No.     Time           Source                Destination           Protocol Length Info
     16 12.416796      2401:4900:598a:b192:7cf7:cce2:285f:3518 2606:50c0:8001::153   TCP      75     53720 → 443 [ACK] Seq=1 Ack=1 Win=256 Len=1 [TCP segment of a reassembled PDU]

Frame 16: 75 bytes on wire (600 bits), 75 bytes captured (600 bits) on interface \Device\NPF_{1315F7C5-5EA1-43CA-9087-EF19375CCA6A}, id 0
Ethernet II, Src: AzureWav_fc:e2:73 (dc:f5:05:fc:e2:73), Dst: 1e:fd:96:3a:4d:31 (1e:fd:96:3a:4d:31)
Internet Protocol Version 6, Src: 2401:4900:598a:b192:7cf7:cce2:285f:3518, Dst: 2606:50c0:8001::153
Transmission Control Protocol, Src Port: 53720, Dst Port: 443, Seq: 1, Ack: 1, Len: 1

No.     Time           Source                Destination           Protocol Length Info
     17 12.619332      2606:50c0:8001::153   2401:4900:598a:b192:7cf7:cce2:285f:3518 TCP      86     443 → 53720 [ACK] Seq=1 Ack=2 Win=278 Len=0 SLE=1 SRE=2

Frame 17: 86 bytes on wire (688 bits), 86 bytes captured (688 bits) on interface \Device\NPF_{1315F7C5-5EA1-43CA-9087-EF19375CCA6A}, id 0
Ethernet II, Src: 1e:fd:96:3a:4d:31 (1e:fd:96:3a:4d:31), Dst: AzureWav_fc:e2:73 (dc:f5:05:fc:e2:73)
Internet Protocol Version 6, Src: 2606:50c0:8001::153, Dst: 2401:4900:598a:b192:7cf7:cce2:285f:3518
Transmission Control Protocol, Src Port: 443, Dst Port: 53720, Seq: 1, Ack: 2, Len: 0

No.     Time           Source                Destination           Protocol Length Info
     18 16.522923      fe80::1cfd:96ff:fe3a:4d31 2401:4900:598a:b192:7cf7:cce2:285f:3518 ICMPv6   86     Neighbor Solicitation for 2401:4900:598a:b192:7cf7:cce2:285f:3518 from 1e:fd:96:3a:4d:31

Frame 18: 86 bytes on wire (688 bits), 86 bytes captured (688 bits) on interface \Device\NPF_{1315F7C5-5EA1-43CA-9087-EF19375CCA6A}, id 0
Ethernet II, Src: 1e:fd:96:3a:4d:31 (1e:fd:96:3a:4d:31), Dst: AzureWav_fc:e2:73 (dc:f5:05:fc:e2:73)
Internet Protocol Version 6, Src: fe80::1cfd:96ff:fe3a:4d31, Dst: 2401:4900:598a:b192:7cf7:cce2:285f:3518
Internet Control Message Protocol v6

No.     Time           Source                Destination           Protocol Length Info
     19 16.523051      2401:4900:598a:b192:7cf7:cce2:285f:3518 fe80::1cfd:96ff:fe3a:4d31 ICMPv6   86     Neighbor Advertisement 2401:4900:598a:b192:7cf7:cce2:285f:3518 (sol, ovr) is at dc:f5:05:fc:e2:73

Frame 19: 86 bytes on wire (688 bits), 86 bytes captured (688 bits) on interface \Device\NPF_{1315F7C5-5EA1-43CA-9087-EF19375CCA6A}, id 0
Ethernet II, Src: AzureWav_fc:e2:73 (dc:f5:05:fc:e2:73), Dst: 1e:fd:96:3a:4d:31 (1e:fd:96:3a:4d:31)
Internet Protocol Version 6, Src: 2401:4900:598a:b192:7cf7:cce2:285f:3518, Dst: fe80::1cfd:96ff:fe3a:4d31
Internet Control Message Protocol v6

No.     Time           Source                Destination           Protocol Length Info
     20 20.721059      140.82.113.25         192.168.69.39         TLSv1.2  79     Application Data

Frame 20: 79 bytes on wire (632 bits), 79 bytes captured (632 bits) on interface \Device\NPF_{1315F7C5-5EA1-43CA-9087-EF19375CCA6A}, id 0
Ethernet II, Src: 1e:fd:96:3a:4d:31 (1e:fd:96:3a:4d:31), Dst: AzureWav_fc:e2:73 (dc:f5:05:fc:e2:73)
Internet Protocol Version 4, Src: 140.82.113.25, Dst: 192.168.69.39
Transmission Control Protocol, Src Port: 443, Dst Port: 53748, Seq: 1, Ack: 2, Len: 25
Transport Layer Security

No.     Time           Source                Destination           Protocol Length Info
     21 20.721910      192.168.69.39         140.82.113.25         TLSv1.2  83     Ignored Unknown Record

Frame 21: 83 bytes on wire (664 bits), 83 bytes captured (664 bits) on interface \Device\NPF_{1315F7C5-5EA1-43CA-9087-EF19375CCA6A}, id 0
Ethernet II, Src: AzureWav_fc:e2:73 (dc:f5:05:fc:e2:73), Dst: 1e:fd:96:3a:4d:31 (1e:fd:96:3a:4d:31)
Internet Protocol Version 4, Src: 192.168.69.39, Dst: 140.82.113.25
Transmission Control Protocol, Src Port: 53748, Dst Port: 443, Seq: 2, Ack: 26, Len: 29
[2 Reassembled TCP Segments (30 bytes): #5(1), #21(29)]
Transport Layer Security

No.     Time           Source                Destination           Protocol Length Info
     22 21.188346      2401:4900:598a:b192:7cf7:cce2:285f:3518 2404:6800:4003:c05::bc TCP      75     53391 → 5228 [ACK] Seq=1 Ack=1 Win=254 Len=1

Frame 22: 75 bytes on wire (600 bits), 75 bytes captured (600 bits) on interface \Device\NPF_{1315F7C5-5EA1-43CA-9087-EF19375CCA6A}, id 0
Ethernet II, Src: AzureWav_fc:e2:73 (dc:f5:05:fc:e2:73), Dst: 1e:fd:96:3a:4d:31 (1e:fd:96:3a:4d:31)
Internet Protocol Version 6, Src: 2401:4900:598a:b192:7cf7:cce2:285f:3518, Dst: 2404:6800:4003:c05::bc
Transmission Control Protocol, Src Port: 53391, Dst Port: 5228, Seq: 1, Ack: 1, Len: 1
Data (1 byte)

0000  00                                                .

No.     Time           Source                Destination           Protocol Length Info
     23 21.438005      140.82.113.25         192.168.69.39         TCP      54     443 → 53748 [ACK] Seq=26 Ack=31 Win=70 Len=0

Frame 23: 54 bytes on wire (432 bits), 54 bytes captured (432 bits) on interface \Device\NPF_{1315F7C5-5EA1-43CA-9087-EF19375CCA6A}, id 0
Ethernet II, Src: 1e:fd:96:3a:4d:31 (1e:fd:96:3a:4d:31), Dst: AzureWav_fc:e2:73 (dc:f5:05:fc:e2:73)
Internet Protocol Version 4, Src: 140.82.113.25, Dst: 192.168.69.39
Transmission Control Protocol, Src Port: 443, Dst Port: 53748, Seq: 26, Ack: 31, Len: 0

No.     Time           Source                Destination           Protocol Length Info
     24 21.438005      2404:6800:4003:c05::bc 2401:4900:598a:b192:7cf7:cce2:285f:3518 TCP      86     5228 → 53391 [ACK] Seq=1 Ack=2 Win=265 Len=0 SLE=1 SRE=2

Frame 24: 86 bytes on wire (688 bits), 86 bytes captured (688 bits) on interface \Device\NPF_{1315F7C5-5EA1-43CA-9087-EF19375CCA6A}, id 0
Ethernet II, Src: 1e:fd:96:3a:4d:31 (1e:fd:96:3a:4d:31), Dst: AzureWav_fc:e2:73 (dc:f5:05:fc:e2:73)
Internet Protocol Version 6, Src: 2404:6800:4003:c05::bc, Dst: 2401:4900:598a:b192:7cf7:cce2:285f:3518
Transmission Control Protocol, Src Port: 5228, Dst Port: 53391, Seq: 1, Ack: 2, Len: 0

No.     Time           Source                Destination           Protocol Length Info
     25 21.703951      192.168.69.39         185.199.111.154       TCP      55     53696 → 443 [ACK] Seq=1 Ack=1 Win=1027 Len=1 [TCP segment of a reassembled PDU]

Frame 25: 55 bytes on wire (440 bits), 55 bytes captured (440 bits) on interface \Device\NPF_{1315F7C5-5EA1-43CA-9087-EF19375CCA6A}, id 0
Ethernet II, Src: AzureWav_fc:e2:73 (dc:f5:05:fc:e2:73), Dst: 1e:fd:96:3a:4d:31 (1e:fd:96:3a:4d:31)
Internet Protocol Version 4, Src: 192.168.69.39, Dst: 185.199.111.154
Transmission Control Protocol, Src Port: 53696, Dst Port: 443, Seq: 1, Ack: 1, Len: 1

No.     Time           Source                Destination           Protocol Length Info
     26 21.849110      185.199.111.154       192.168.69.39         TCP      66     443 → 53696 [ACK] Seq=1 Ack=2 Win=391 Len=0 SLE=1 SRE=2

Frame 26: 66 bytes on wire (528 bits), 66 bytes captured (528 bits) on interface \Device\NPF_{1315F7C5-5EA1-43CA-9087-EF19375CCA6A}, id 0
Ethernet II, Src: 1e:fd:96:3a:4d:31 (1e:fd:96:3a:4d:31), Dst: AzureWav_fc:e2:73 (dc:f5:05:fc:e2:73)
Internet Protocol Version 4, Src: 185.199.111.154, Dst: 192.168.69.39
Transmission Control Protocol, Src Port: 443, Dst Port: 53696, Seq: 1, Ack: 2, Len: 0

No.     Time           Source                Destination           Protocol Length Info
     27 29.890165      2401:4900:598a:b192:7cf7:cce2:285f:3518 2606:50c0:8003::154   TCP      75     53699 → 443 [ACK] Seq=1 Ack=1 Win=256 Len=1 [TCP segment of a reassembled PDU]

Frame 27: 75 bytes on wire (600 bits), 75 bytes captured (600 bits) on interface \Device\NPF_{1315F7C5-5EA1-43CA-9087-EF19375CCA6A}, id 0
Ethernet II, Src: AzureWav_fc:e2:73 (dc:f5:05:fc:e2:73), Dst: 1e:fd:96:3a:4d:31 (1e:fd:96:3a:4d:31)
Internet Protocol Version 6, Src: 2401:4900:598a:b192:7cf7:cce2:285f:3518, Dst: 2606:50c0:8003::154
Transmission Control Protocol, Src Port: 53699, Dst Port: 443, Seq: 1, Ack: 1, Len: 1

No.     Time           Source                Destination           Protocol Length Info
     28 30.244440      2606:50c0:8003::154   2401:4900:598a:b192:7cf7:cce2:285f:3518 TCP      86     443 → 53699 [ACK] Seq=1 Ack=2 Win=284 Len=0 SLE=1 SRE=2

Frame 28: 86 bytes on wire (688 bits), 86 bytes captured (688 bits) on interface \Device\NPF_{1315F7C5-5EA1-43CA-9087-EF19375CCA6A}, id 0
Ethernet II, Src: 1e:fd:96:3a:4d:31 (1e:fd:96:3a:4d:31), Dst: AzureWav_fc:e2:73 (dc:f5:05:fc:e2:73)
Internet Protocol Version 6, Src: 2606:50c0:8003::154, Dst: 2401:4900:598a:b192:7cf7:cce2:285f:3518
Transmission Control Protocol, Src Port: 443, Dst Port: 53699, Seq: 1, Ack: 2, Len: 0

No.     Time           Source                Destination           Protocol Length Info
     29 41.405791      20.207.73.85          192.168.69.39         TLSv1.2  93     Application Data

Frame 29: 93 bytes on wire (744 bits), 93 bytes captured (744 bits) on interface \Device\NPF_{1315F7C5-5EA1-43CA-9087-EF19375CCA6A}, id 0
Ethernet II, Src: 1e:fd:96:3a:4d:31 (1e:fd:96:3a:4d:31), Dst: AzureWav_fc:e2:73 (dc:f5:05:fc:e2:73)
Internet Protocol Version 4, Src: 20.207.73.85, Dst: 192.168.69.39
Transmission Control Protocol, Src Port: 443, Dst Port: 53749, Seq: 1, Ack: 2, Len: 39
Transport Layer Security

No.     Time           Source                Destination           Protocol Length Info
     30 41.405791      20.207.73.85          192.168.69.39         TLSv1.2  78     Application Data

Frame 30: 78 bytes on wire (624 bits), 78 bytes captured (624 bits) on interface \Device\NPF_{1315F7C5-5EA1-43CA-9087-EF19375CCA6A}, id 0
Ethernet II, Src: 1e:fd:96:3a:4d:31 (1e:fd:96:3a:4d:31), Dst: AzureWav_fc:e2:73 (dc:f5:05:fc:e2:73)
Internet Protocol Version 4, Src: 20.207.73.85, Dst: 192.168.69.39
Transmission Control Protocol, Src Port: 443, Dst Port: 53749, Seq: 40, Ack: 2, Len: 24
Transport Layer Security

No.     Time           Source                Destination           Protocol Length Info
     31 41.405986      192.168.69.39         20.207.73.85          TCP      54     53749 → 443 [ACK] Seq=2 Ack=64 Win=257 Len=0

Frame 31: 54 bytes on wire (432 bits), 54 bytes captured (432 bits) on interface \Device\NPF_{1315F7C5-5EA1-43CA-9087-EF19375CCA6A}, id 0
Ethernet II, Src: AzureWav_fc:e2:73 (dc:f5:05:fc:e2:73), Dst: 1e:fd:96:3a:4d:31 (1e:fd:96:3a:4d:31)
Internet Protocol Version 4, Src: 192.168.69.39, Dst: 20.207.73.85
Transmission Control Protocol, Src Port: 53749, Dst Port: 443, Seq: 2, Ack: 64, Len: 0

No.     Time           Source                Destination           Protocol Length Info
     32 41.406534      192.168.69.39         20.207.73.85          TCP      54     53749 → 443 [FIN, ACK] Seq=2 Ack=64 Win=257 Len=0

Frame 32: 54 bytes on wire (432 bits), 54 bytes captured (432 bits) on interface \Device\NPF_{1315F7C5-5EA1-43CA-9087-EF19375CCA6A}, id 0
Ethernet II, Src: AzureWav_fc:e2:73 (dc:f5:05:fc:e2:73), Dst: 1e:fd:96:3a:4d:31 (1e:fd:96:3a:4d:31)
Internet Protocol Version 4, Src: 192.168.69.39, Dst: 20.207.73.85
Transmission Control Protocol, Src Port: 53749, Dst Port: 443, Seq: 2, Ack: 64, Len: 0

No.     Time           Source                Destination           Protocol Length Info
     33 41.407071      20.207.73.85          192.168.69.39         TCP      54     443 → 53749 [FIN, ACK] Seq=64 Ack=2 Win=68 Len=0

Frame 33: 54 bytes on wire (432 bits), 54 bytes captured (432 bits) on interface \Device\NPF_{1315F7C5-5EA1-43CA-9087-EF19375CCA6A}, id 0
Ethernet II, Src: 1e:fd:96:3a:4d:31 (1e:fd:96:3a:4d:31), Dst: AzureWav_fc:e2:73 (dc:f5:05:fc:e2:73)
Internet Protocol Version 4, Src: 20.207.73.85, Dst: 192.168.69.39
Transmission Control Protocol, Src Port: 443, Dst Port: 53749, Seq: 64, Ack: 2, Len: 0

No.     Time           Source                Destination           Protocol Length Info
     34 41.407198      192.168.69.39         20.207.73.85          TCP      54     53749 → 443 [ACK] Seq=3 Ack=65 Win=257 Len=0

Frame 34: 54 bytes on wire (432 bits), 54 bytes captured (432 bits) on interface \Device\NPF_{1315F7C5-5EA1-43CA-9087-EF19375CCA6A}, id 0
Ethernet II, Src: AzureWav_fc:e2:73 (dc:f5:05:fc:e2:73), Dst: 1e:fd:96:3a:4d:31 (1e:fd:96:3a:4d:31)
Internet Protocol Version 4, Src: 192.168.69.39, Dst: 20.207.73.85
Transmission Control Protocol, Src Port: 53749, Dst Port: 443, Seq: 3, Ack: 65, Len: 0

No.     Time           Source                Destination           Protocol Length Info
     35 41.742646      20.207.73.85          192.168.69.39         TCP      54     443 → 53749 [ACK] Seq=65 Ack=3 Win=68 Len=0

Frame 35: 54 bytes on wire (432 bits), 54 bytes captured (432 bits) on interface \Device\NPF_{1315F7C5-5EA1-43CA-9087-EF19375CCA6A}, id 0
Ethernet II, Src: 1e:fd:96:3a:4d:31 (1e:fd:96:3a:4d:31), Dst: AzureWav_fc:e2:73 (dc:f5:05:fc:e2:73)
Internet Protocol Version 4, Src: 20.207.73.85, Dst: 192.168.69.39
Transmission Control Protocol, Src Port: 443, Dst Port: 53749, Seq: 65, Ack: 3, Len: 0

No.     Time           Source                Destination           Protocol Length Info
     36 46.422884      1e:fd:96:3a:4d:31     AzureWav_fc:e2:73     ARP      42     Who has 192.168.69.39? Tell 192.168.69.80

Frame 36: 42 bytes on wire (336 bits), 42 bytes captured (336 bits) on interface \Device\NPF_{1315F7C5-5EA1-43CA-9087-EF19375CCA6A}, id 0
Ethernet II, Src: 1e:fd:96:3a:4d:31 (1e:fd:96:3a:4d:31), Dst: AzureWav_fc:e2:73 (dc:f5:05:fc:e2:73)
Address Resolution Protocol (request)

No.     Time           Source                Destination           Protocol Length Info
     37 46.422938      AzureWav_fc:e2:73     1e:fd:96:3a:4d:31     ARP      42     192.168.69.39 is at dc:f5:05:fc:e2:73

Frame 37: 42 bytes on wire (336 bits), 42 bytes captured (336 bits) on interface \Device\NPF_{1315F7C5-5EA1-43CA-9087-EF19375CCA6A}, id 0
Ethernet II, Src: AzureWav_fc:e2:73 (dc:f5:05:fc:e2:73), Dst: 1e:fd:96:3a:4d:31 (1e:fd:96:3a:4d:31)
Address Resolution Protocol (reply)

No.     Time           Source                Destination           Protocol Length Info
     38 56.147324      192.168.69.39         239.255.255.250       SSDP     216    M-SEARCH * HTTP/1.1 

Frame 38: 216 bytes on wire (1728 bits), 216 bytes captured (1728 bits) on interface \Device\NPF_{1315F7C5-5EA1-43CA-9087-EF19375CCA6A}, id 0
Ethernet II, Src: AzureWav_fc:e2:73 (dc:f5:05:fc:e2:73), Dst: IPv4mcast_7f:ff:fa (01:00:5e:7f:ff:fa)
Internet Protocol Version 4, Src: 192.168.69.39, Dst: 239.255.255.250
User Datagram Protocol, Src Port: 61348, Dst Port: 1900
Simple Service Discovery Protocol

No.     Time           Source                Destination           Protocol Length Info
     39 57.091147      192.168.69.39         185.199.111.154       TCP      55     [TCP Keep-Alive] 53692 → 443 [ACK] Seq=1 Ack=1 Win=1029 Len=1

Frame 39: 55 bytes on wire (440 bits), 55 bytes captured (440 bits) on interface \Device\NPF_{1315F7C5-5EA1-43CA-9087-EF19375CCA6A}, id 0
Ethernet II, Src: AzureWav_fc:e2:73 (dc:f5:05:fc:e2:73), Dst: 1e:fd:96:3a:4d:31 (1e:fd:96:3a:4d:31)
Internet Protocol Version 4, Src: 192.168.69.39, Dst: 185.199.111.154
Transmission Control Protocol, Src Port: 53692, Dst Port: 443, Seq: 1, Ack: 1, Len: 1

No.     Time           Source                Destination           Protocol Length Info
     40 57.154473      192.168.69.39         239.255.255.250       SSDP     216    M-SEARCH * HTTP/1.1 

Frame 40: 216 bytes on wire (1728 bits), 216 bytes captured (1728 bits) on interface \Device\NPF_{1315F7C5-5EA1-43CA-9087-EF19375CCA6A}, id 0
Ethernet II, Src: AzureWav_fc:e2:73 (dc:f5:05:fc:e2:73), Dst: IPv4mcast_7f:ff:fa (01:00:5e:7f:ff:fa)
Internet Protocol Version 4, Src: 192.168.69.39, Dst: 239.255.255.250
User Datagram Protocol, Src Port: 61348, Dst Port: 1900
Simple Service Discovery Protocol

No.     Time           Source                Destination           Protocol Length Info
     41 57.380175      185.199.111.154       192.168.69.39         TCP      66     [TCP Keep-Alive ACK] 443 → 53692 [ACK] Seq=1 Ack=2 Win=288 Len=0 SLE=1 SRE=2

Frame 41: 66 bytes on wire (528 bits), 66 bytes captured (528 bits) on interface \Device\NPF_{1315F7C5-5EA1-43CA-9087-EF19375CCA6A}, id 0
Ethernet II, Src: 1e:fd:96:3a:4d:31 (1e:fd:96:3a:4d:31), Dst: AzureWav_fc:e2:73 (dc:f5:05:fc:e2:73)
Internet Protocol Version 4, Src: 185.199.111.154, Dst: 192.168.69.39
Transmission Control Protocol, Src Port: 443, Dst Port: 53692, Seq: 1, Ack: 2, Len: 0

No.     Time           Source                Destination           Protocol Length Info
     42 57.388848      2401:4900:598a:b192:7cf7:cce2:285f:3518 2606:50c0:8000::153   TCP      75     [TCP Keep-Alive] 53718 → 443 [ACK] Seq=1 Ack=1 Win=1034 Len=1

Frame 42: 75 bytes on wire (600 bits), 75 bytes captured (600 bits) on interface \Device\NPF_{1315F7C5-5EA1-43CA-9087-EF19375CCA6A}, id 0
Ethernet II, Src: AzureWav_fc:e2:73 (dc:f5:05:fc:e2:73), Dst: 1e:fd:96:3a:4d:31 (1e:fd:96:3a:4d:31)
Internet Protocol Version 6, Src: 2401:4900:598a:b192:7cf7:cce2:285f:3518, Dst: 2606:50c0:8000::153
Transmission Control Protocol, Src Port: 53718, Dst Port: 443, Seq: 1, Ack: 1, Len: 1

No.     Time           Source                Destination           Protocol Length Info
     43 57.626256      2401:4900:598a:b192:7cf7:cce2:285f:3518 2606:50c0:8001::153   TCP      75     [TCP Keep-Alive] 53720 → 443 [ACK] Seq=1 Ack=1 Win=256 Len=1

Frame 43: 75 bytes on wire (600 bits), 75 bytes captured (600 bits) on interface \Device\NPF_{1315F7C5-5EA1-43CA-9087-EF19375CCA6A}, id 0
Ethernet II, Src: AzureWav_fc:e2:73 (dc:f5:05:fc:e2:73), Dst: 1e:fd:96:3a:4d:31 (1e:fd:96:3a:4d:31)
Internet Protocol Version 6, Src: 2401:4900:598a:b192:7cf7:cce2:285f:3518, Dst: 2606:50c0:8001::153
Transmission Control Protocol, Src Port: 53720, Dst Port: 443, Seq: 1, Ack: 1, Len: 1

No.     Time           Source                Destination           Protocol Length Info
     44 57.789864      2606:50c0:8000::153   2401:4900:598a:b192:7cf7:cce2:285f:3518 TCP      86     [TCP Keep-Alive ACK] 443 → 53718 [ACK] Seq=1 Ack=2 Win=297 Len=0 SLE=1 SRE=2

Frame 44: 86 bytes on wire (688 bits), 86 bytes captured (688 bits) on interface \Device\NPF_{1315F7C5-5EA1-43CA-9087-EF19375CCA6A}, id 0
Ethernet II, Src: 1e:fd:96:3a:4d:31 (1e:fd:96:3a:4d:31), Dst: AzureWav_fc:e2:73 (dc:f5:05:fc:e2:73)
Internet Protocol Version 6, Src: 2606:50c0:8000::153, Dst: 2401:4900:598a:b192:7cf7:cce2:285f:3518
Transmission Control Protocol, Src Port: 443, Dst Port: 53718, Seq: 1, Ack: 2, Len: 0

No.     Time           Source                Destination           Protocol Length Info
     45 57.891924      2606:50c0:8001::153   2401:4900:598a:b192:7cf7:cce2:285f:3518 TCP      86     [TCP Keep-Alive ACK] 443 → 53720 [ACK] Seq=1 Ack=2 Win=278 Len=0 SLE=1 SRE=2

Frame 45: 86 bytes on wire (688 bits), 86 bytes captured (688 bits) on interface \Device\NPF_{1315F7C5-5EA1-43CA-9087-EF19375CCA6A}, id 0
Ethernet II, Src: 1e:fd:96:3a:4d:31 (1e:fd:96:3a:4d:31), Dst: AzureWav_fc:e2:73 (dc:f5:05:fc:e2:73)
Internet Protocol Version 6, Src: 2606:50c0:8001::153, Dst: 2401:4900:598a:b192:7cf7:cce2:285f:3518
Transmission Control Protocol, Src Port: 443, Dst Port: 53720, Seq: 1, Ack: 2, Len: 0

No.     Time           Source                Destination           Protocol Length Info
     46 58.161053      192.168.69.39         239.255.255.250       SSDP     216    M-SEARCH * HTTP/1.1 

Frame 46: 216 bytes on wire (1728 bits), 216 bytes captured (1728 bits) on interface \Device\NPF_{1315F7C5-5EA1-43CA-9087-EF19375CCA6A}, id 0
Ethernet II, Src: AzureWav_fc:e2:73 (dc:f5:05:fc:e2:73), Dst: IPv4mcast_7f:ff:fa (01:00:5e:7f:ff:fa)
Internet Protocol Version 4, Src: 192.168.69.39, Dst: 239.255.255.250
User Datagram Protocol, Src Port: 61348, Dst Port: 1900
Simple Service Discovery Protocol

No.     Time           Source                Destination           Protocol Length Info
     47 59.162612      192.168.69.39         239.255.255.250       SSDP     216    M-SEARCH * HTTP/1.1 

Frame 47: 216 bytes on wire (1728 bits), 216 bytes captured (1728 bits) on interface \Device\NPF_{1315F7C5-5EA1-43CA-9087-EF19375CCA6A}, id 0
Ethernet II, Src: AzureWav_fc:e2:73 (dc:f5:05:fc:e2:73), Dst: IPv4mcast_7f:ff:fa (01:00:5e:7f:ff:fa)
Internet Protocol Version 4, Src: 192.168.69.39, Dst: 239.255.255.250
User Datagram Protocol, Src Port: 61348, Dst Port: 1900
Simple Service Discovery Protocol

No.     Time           Source                Destination           Protocol Length Info
     48 62.500276      fe80::1cfd:96ff:fe3a:4d31 2401:4900:598a:b192:7cf7:cce2:285f:3518 ICMPv6   86     Neighbor Solicitation for 2401:4900:598a:b192:7cf7:cce2:285f:3518 from 1e:fd:96:3a:4d:31

Frame 48: 86 bytes on wire (688 bits), 86 bytes captured (688 bits) on interface \Device\NPF_{1315F7C5-5EA1-43CA-9087-EF19375CCA6A}, id 0
Ethernet II, Src: 1e:fd:96:3a:4d:31 (1e:fd:96:3a:4d:31), Dst: AzureWav_fc:e2:73 (dc:f5:05:fc:e2:73)
Internet Protocol Version 6, Src: fe80::1cfd:96ff:fe3a:4d31, Dst: 2401:4900:598a:b192:7cf7:cce2:285f:3518
Internet Control Message Protocol v6

No.     Time           Source                Destination           Protocol Length Info
     49 62.500398      2401:4900:598a:b192:7cf7:cce2:285f:3518 fe80::1cfd:96ff:fe3a:4d31 ICMPv6   86     Neighbor Advertisement 2401:4900:598a:b192:7cf7:cce2:285f:3518 (sol, ovr) is at dc:f5:05:fc:e2:73

Frame 49: 86 bytes on wire (688 bits), 86 bytes captured (688 bits) on interface \Device\NPF_{1315F7C5-5EA1-43CA-9087-EF19375CCA6A}, id 0
Ethernet II, Src: AzureWav_fc:e2:73 (dc:f5:05:fc:e2:73), Dst: 1e:fd:96:3a:4d:31 (1e:fd:96:3a:4d:31)
Internet Protocol Version 6, Src: 2401:4900:598a:b192:7cf7:cce2:285f:3518, Dst: fe80::1cfd:96ff:fe3a:4d31
Internet Control Message Protocol v6

No.     Time           Source                Destination           Protocol Length Info
     50 65.367639      2606:50c0:8001::153   2401:4900:598a:b192:7cf7:cce2:285f:3518 TLSv1.2  98     [TCP Previous segment not captured] , Application Data

Frame 50: 98 bytes on wire (784 bits), 98 bytes captured (784 bits) on interface \Device\NPF_{1315F7C5-5EA1-43CA-9087-EF19375CCA6A}, id 0
Ethernet II, Src: 1e:fd:96:3a:4d:31 (1e:fd:96:3a:4d:31), Dst: AzureWav_fc:e2:73 (dc:f5:05:fc:e2:73)
Internet Protocol Version 6, Src: 2606:50c0:8001::153, Dst: 2401:4900:598a:b192:7cf7:cce2:285f:3518
Transmission Control Protocol, Src Port: 443, Dst Port: 53720, Seq: 52, Ack: 2, Len: 24
Transport Layer Security

No.     Time           Source                Destination           Protocol Length Info
     51 65.367729      2401:4900:598a:b192:7cf7:cce2:285f:3518 2606:50c0:8001::153   TCP      86     [TCP Dup ACK 16#1] 53720 → 443 [ACK] Seq=2 Ack=1 Win=256 Len=0 SLE=52 SRE=76

Frame 51: 86 bytes on wire (688 bits), 86 bytes captured (688 bits) on interface \Device\NPF_{1315F7C5-5EA1-43CA-9087-EF19375CCA6A}, id 0
Ethernet II, Src: AzureWav_fc:e2:73 (dc:f5:05:fc:e2:73), Dst: 1e:fd:96:3a:4d:31 (1e:fd:96:3a:4d:31)
Internet Protocol Version 6, Src: 2401:4900:598a:b192:7cf7:cce2:285f:3518, Dst: 2606:50c0:8001::153
Transmission Control Protocol, Src Port: 53720, Dst Port: 443, Seq: 2, Ack: 1, Len: 0

No.     Time           Source                Destination           Protocol Length Info
     52 66.444900      192.168.69.39         140.82.113.25         TCP      55     [TCP Keep-Alive] 53748 → 443 [ACK] Seq=30 Ack=26 Win=254 Len=1[Reassembly error, protocol TCP: New fragment overlaps old data (retransmission?)]

Frame 52: 55 bytes on wire (440 bits), 55 bytes captured (440 bits) on interface \Device\NPF_{1315F7C5-5EA1-43CA-9087-EF19375CCA6A}, id 0
Ethernet II, Src: AzureWav_fc:e2:73 (dc:f5:05:fc:e2:73), Dst: 1e:fd:96:3a:4d:31 (1e:fd:96:3a:4d:31)
Internet Protocol Version 4, Src: 192.168.69.39, Dst: 140.82.113.25
Transmission Control Protocol, Src Port: 53748, Dst Port: 443, Seq: 30, Ack: 26, Len: 1
[Reassembly error, protocol TCP: New fragment overlaps old data (retransmission?)]

No.     Time           Source                Destination           Protocol Length Info
     53 66.444903      2401:4900:598a:b192:7cf7:cce2:285f:3518 2404:6800:4003:c05::bc TCP      75     [TCP Keep-Alive] 53391 → 5228 [ACK] Seq=1 Ack=1 Win=254 Len=1

Frame 53: 75 bytes on wire (600 bits), 75 bytes captured (600 bits) on interface \Device\NPF_{1315F7C5-5EA1-43CA-9087-EF19375CCA6A}, id 0
Ethernet II, Src: AzureWav_fc:e2:73 (dc:f5:05:fc:e2:73), Dst: 1e:fd:96:3a:4d:31 (1e:fd:96:3a:4d:31)
Internet Protocol Version 6, Src: 2401:4900:598a:b192:7cf7:cce2:285f:3518, Dst: 2404:6800:4003:c05::bc
Transmission Control Protocol, Src Port: 53391, Dst Port: 5228, Seq: 1, Ack: 1, Len: 1
Data (1 byte)

0000  00                                                .

No.     Time           Source                Destination           Protocol Length Info
     54 66.596432      2606:50c0:8001::153   2401:4900:598a:b192:7cf7:cce2:285f:3518 TCP      149    [TCP Retransmission] 443 → 53720 [FIN, PSH, ACK] Seq=1 Ack=2 Win=278 Len=75

Frame 54: 149 bytes on wire (1192 bits), 149 bytes captured (1192 bits) on interface \Device\NPF_{1315F7C5-5EA1-43CA-9087-EF19375CCA6A}, id 0
Ethernet II, Src: 1e:fd:96:3a:4d:31 (1e:fd:96:3a:4d:31), Dst: AzureWav_fc:e2:73 (dc:f5:05:fc:e2:73)
Internet Protocol Version 6, Src: 2606:50c0:8001::153, Dst: 2401:4900:598a:b192:7cf7:cce2:285f:3518
Transmission Control Protocol, Src Port: 443, Dst Port: 53720, Seq: 1, Ack: 2, Len: 75

No.     Time           Source                Destination           Protocol Length Info
     55 66.596634      2401:4900:598a:b192:7cf7:cce2:285f:3518 2606:50c0:8001::153   TCP      86     53720 → 443 [ACK] Seq=2 Ack=77 Win=256 Len=0 SLE=52 SRE=76

Frame 55: 86 bytes on wire (688 bits), 86 bytes captured (688 bits) on interface \Device\NPF_{1315F7C5-5EA1-43CA-9087-EF19375CCA6A}, id 0
Ethernet II, Src: AzureWav_fc:e2:73 (dc:f5:05:fc:e2:73), Dst: 1e:fd:96:3a:4d:31 (1e:fd:96:3a:4d:31)
Internet Protocol Version 6, Src: 2401:4900:598a:b192:7cf7:cce2:285f:3518, Dst: 2606:50c0:8001::153
Transmission Control Protocol, Src Port: 53720, Dst Port: 443, Seq: 2, Ack: 77, Len: 0

No.     Time           Source                Destination           Protocol Length Info
     56 66.597297      2401:4900:598a:b192:7cf7:cce2:285f:3518 2606:50c0:8001::153   TCP      74     53720 → 443 [FIN, ACK] Seq=2 Ack=77 Win=256 Len=0

Frame 56: 74 bytes on wire (592 bits), 74 bytes captured (592 bits) on interface \Device\NPF_{1315F7C5-5EA1-43CA-9087-EF19375CCA6A}, id 0
Ethernet II, Src: AzureWav_fc:e2:73 (dc:f5:05:fc:e2:73), Dst: 1e:fd:96:3a:4d:31 (1e:fd:96:3a:4d:31)
Internet Protocol Version 6, Src: 2401:4900:598a:b192:7cf7:cce2:285f:3518, Dst: 2606:50c0:8001::153
Transmission Control Protocol, Src Port: 53720, Dst Port: 443, Seq: 2, Ack: 77, Len: 0

No.     Time           Source                Destination           Protocol Length Info
     57 66.698677      2606:50c0:8000::153   2401:4900:598a:b192:7cf7:cce2:285f:3518 TLSv1.2  149    Application Data, Application Data

Frame 57: 149 bytes on wire (1192 bits), 149 bytes captured (1192 bits) on interface \Device\NPF_{1315F7C5-5EA1-43CA-9087-EF19375CCA6A}, id 0
Ethernet II, Src: 1e:fd:96:3a:4d:31 (1e:fd:96:3a:4d:31), Dst: AzureWav_fc:e2:73 (dc:f5:05:fc:e2:73)
Internet Protocol Version 6, Src: 2606:50c0:8000::153, Dst: 2401:4900:598a:b192:7cf7:cce2:285f:3518
Transmission Control Protocol, Src Port: 443, Dst Port: 53718, Seq: 1, Ack: 2, Len: 75
Transport Layer Security

No.     Time           Source                Destination           Protocol Length Info
     58 66.698874      2401:4900:598a:b192:7cf7:cce2:285f:3518 2606:50c0:8000::153   TCP      74     53718 → 443 [ACK] Seq=2 Ack=77 Win=1034 Len=0

Frame 58: 74 bytes on wire (592 bits), 74 bytes captured (592 bits) on interface \Device\NPF_{1315F7C5-5EA1-43CA-9087-EF19375CCA6A}, id 0
Ethernet II, Src: AzureWav_fc:e2:73 (dc:f5:05:fc:e2:73), Dst: 1e:fd:96:3a:4d:31 (1e:fd:96:3a:4d:31)
Internet Protocol Version 6, Src: 2401:4900:598a:b192:7cf7:cce2:285f:3518, Dst: 2606:50c0:8000::153
Transmission Control Protocol, Src Port: 53718, Dst Port: 443, Seq: 2, Ack: 77, Len: 0

No.     Time           Source                Destination           Protocol Length Info
     59 66.699511      2401:4900:598a:b192:7cf7:cce2:285f:3518 2606:50c0:8000::153   TCP      74     53718 → 443 [FIN, ACK] Seq=2 Ack=77 Win=1034 Len=0

Frame 59: 74 bytes on wire (592 bits), 74 bytes captured (592 bits) on interface \Device\NPF_{1315F7C5-5EA1-43CA-9087-EF19375CCA6A}, id 0
Ethernet II, Src: AzureWav_fc:e2:73 (dc:f5:05:fc:e2:73), Dst: 1e:fd:96:3a:4d:31 (1e:fd:96:3a:4d:31)
Internet Protocol Version 6, Src: 2401:4900:598a:b192:7cf7:cce2:285f:3518, Dst: 2606:50c0:8000::153
Transmission Control Protocol, Src Port: 53718, Dst Port: 443, Seq: 2, Ack: 77, Len: 0

No.     Time           Source                Destination           Protocol Length Info
     60 66.800175      185.199.111.154       192.168.69.39         TLSv1.2  105    Application Data

Frame 60: 105 bytes on wire (840 bits), 105 bytes captured (840 bits) on interface \Device\NPF_{1315F7C5-5EA1-43CA-9087-EF19375CCA6A}, id 0
Ethernet II, Src: 1e:fd:96:3a:4d:31 (1e:fd:96:3a:4d:31), Dst: AzureWav_fc:e2:73 (dc:f5:05:fc:e2:73)
Internet Protocol Version 4, Src: 185.199.111.154, Dst: 192.168.69.39
Transmission Control Protocol, Src Port: 443, Dst Port: 53692, Seq: 1, Ack: 2, Len: 51
Transport Layer Security

No.     Time           Source                Destination           Protocol Length Info
     61 66.800762      192.168.69.39         185.199.111.154       TCP      54     53692 → 443 [FIN, ACK] Seq=2 Ack=52 Win=1029 Len=0

Frame 61: 54 bytes on wire (432 bits), 54 bytes captured (432 bits) on interface \Device\NPF_{1315F7C5-5EA1-43CA-9087-EF19375CCA6A}, id 0
Ethernet II, Src: AzureWav_fc:e2:73 (dc:f5:05:fc:e2:73), Dst: 1e:fd:96:3a:4d:31 (1e:fd:96:3a:4d:31)
Internet Protocol Version 4, Src: 192.168.69.39, Dst: 185.199.111.154
Transmission Control Protocol, Src Port: 53692, Dst Port: 443, Seq: 2, Ack: 52, Len: 0

No.     Time           Source                Destination           Protocol Length Info
     62 66.803303      185.199.111.154       192.168.69.39         TLSv1.2  78     Application Data

Frame 62: 78 bytes on wire (624 bits), 78 bytes captured (624 bits) on interface \Device\NPF_{1315F7C5-5EA1-43CA-9087-EF19375CCA6A}, id 0
Ethernet II, Src: 1e:fd:96:3a:4d:31 (1e:fd:96:3a:4d:31), Dst: AzureWav_fc:e2:73 (dc:f5:05:fc:e2:73)
