No.     Time           Source                Destination           Protocol Length Info
      1 0.000000       192.168.69.39         239.255.255.250       SSDP     217    M-SEARCH * HTTP/1.1 

Frame 1: 217 bytes on wire (1736 bits), 217 bytes captured (1736 bits) on interface \Device\NPF_{1315F7C5-5EA1-43CA-9087-EF19375CCA6A}, id 0
Ethernet II, Src: AzureWav_fc:e2:73 (dc:f5:05:fc:e2:73), Dst: IPv4mcast_7f:ff:fa (01:00:5e:7f:ff:fa)
Internet Protocol Version 4, Src: 192.168.69.39, Dst: 239.255.255.250
User Datagram Protocol, Src Port: 57450, Dst Port: 1900
Simple Service Discovery Protocol

No.     Time           Source                Destination           Protocol Length Info
      2 1.015762       192.168.69.39         239.255.255.250       SSDP     217    M-SEARCH * HTTP/1.1 

Frame 2: 217 bytes on wire (1736 bits), 217 bytes captured (1736 bits) on interface \Device\NPF_{1315F7C5-5EA1-43CA-9087-EF19375CCA6A}, id 0
Ethernet II, Src: AzureWav_fc:e2:73 (dc:f5:05:fc:e2:73), Dst: IPv4mcast_7f:ff:fa (01:00:5e:7f:ff:fa)
Internet Protocol Version 4, Src: 192.168.69.39, Dst: 239.255.255.250
User Datagram Protocol, Src Port: 57450, Dst Port: 1900
Simple Service Discovery Protocol

No.     Time           Source                Destination           Protocol Length Info
      3 2.021837       192.168.69.39         239.255.255.250       SSDP     217    M-SEARCH * HTTP/1.1 

Frame 3: 217 bytes on wire (1736 bits), 217 bytes captured (1736 bits) on interface \Device\NPF_{1315F7C5-5EA1-43CA-9087-EF19375CCA6A}, id 0
Ethernet II, Src: AzureWav_fc:e2:73 (dc:f5:05:fc:e2:73), Dst: IPv4mcast_7f:ff:fa (01:00:5e:7f:ff:fa)
Internet Protocol Version 4, Src: 192.168.69.39, Dst: 239.255.255.250
User Datagram Protocol, Src Port: 57450, Dst Port: 1900
Simple Service Discovery Protocol

No.     Time           Source                Destination           Protocol Length Info
      4 3.436284       fe80::1cfd:96ff:fe3a:4d31 2401:4900:598a:b192:7cf7:cce2:285f:3518 ICMPv6   86     Neighbor Solicitation for 2401:4900:598a:b192:7cf7:cce2:285f:3518 from 1e:fd:96:3a:4d:31

Frame 4: 86 bytes on wire (688 bits), 86 bytes captured (688 bits) on interface \Device\NPF_{1315F7C5-5EA1-43CA-9087-EF19375CCA6A}, id 0
Ethernet II, Src: 1e:fd:96:3a:4d:31 (1e:fd:96:3a:4d:31), Dst: AzureWav_fc:e2:73 (dc:f5:05:fc:e2:73)
Internet Protocol Version 6, Src: fe80::1cfd:96ff:fe3a:4d31, Dst: 2401:4900:598a:b192:7cf7:cce2:285f:3518
Internet Control Message Protocol v6

No.     Time           Source                Destination           Protocol Length Info
      5 3.436420       2401:4900:598a:b192:7cf7:cce2:285f:3518 fe80::1cfd:96ff:fe3a:4d31 ICMPv6   86     Neighbor Advertisement 2401:4900:598a:b192:7cf7:cce2:285f:3518 (sol, ovr) is at dc:f5:05:fc:e2:73

Frame 5: 86 bytes on wire (688 bits), 86 bytes captured (688 bits) on interface \Device\NPF_{1315F7C5-5EA1-43CA-9087-EF19375CCA6A}, id 0
Ethernet II, Src: AzureWav_fc:e2:73 (dc:f5:05:fc:e2:73), Dst: 1e:fd:96:3a:4d:31 (1e:fd:96:3a:4d:31)
Internet Protocol Version 6, Src: 2401:4900:598a:b192:7cf7:cce2:285f:3518, Dst: fe80::1cfd:96ff:fe3a:4d31
Internet Control Message Protocol v6

No.     Time           Source                Destination           Protocol Length Info
      6 6.188519       192.168.69.39         192.168.69.255        NBNS     92     Name query NB LAPTOP-K91LS1U6<1c>

Frame 6: 92 bytes on wire (736 bits), 92 bytes captured (736 bits) on interface \Device\NPF_{1315F7C5-5EA1-43CA-9087-EF19375CCA6A}, id 0
Ethernet II, Src: AzureWav_fc:e2:73 (dc:f5:05:fc:e2:73), Dst: Broadcast (ff:ff:ff:ff:ff:ff)
Internet Protocol Version 4, Src: 192.168.69.39, Dst: 192.168.69.255
User Datagram Protocol, Src Port: 137, Dst Port: 137
NetBIOS Name Service

No.     Time           Source                Destination           Protocol Length Info
      7 6.945717       192.168.69.39         192.168.69.255        NBNS     92     Name query NB LAPTOP-K91LS1U6<1c>

Frame 7: 92 bytes on wire (736 bits), 92 bytes captured (736 bits) on interface \Device\NPF_{1315F7C5-5EA1-43CA-9087-EF19375CCA6A}, id 0
Ethernet II, Src: AzureWav_fc:e2:73 (dc:f5:05:fc:e2:73), Dst: Broadcast (ff:ff:ff:ff:ff:ff)
Internet Protocol Version 4, Src: 192.168.69.39, Dst: 192.168.69.255
User Datagram Protocol, Src Port: 137, Dst Port: 137
NetBIOS Name Service

No.     Time           Source                Destination           Protocol Length Info
      8 7.705499       192.168.69.39         192.168.69.255        NBNS     92     Name query NB LAPTOP-K91LS1U6<1c>

Frame 8: 92 bytes on wire (736 bits), 92 bytes captured (736 bits) on interface \Device\NPF_{1315F7C5-5EA1-43CA-9087-EF19375CCA6A}, id 0
Ethernet II, Src: AzureWav_fc:e2:73 (dc:f5:05:fc:e2:73), Dst: Broadcast (ff:ff:ff:ff:ff:ff)
Internet Protocol Version 4, Src: 192.168.69.39, Dst: 192.168.69.255
User Datagram Protocol, Src Port: 137, Dst Port: 137
NetBIOS Name Service

No.     Time           Source                Destination           Protocol Length Info
      9 7.978005       192.168.69.39         192.168.69.80         DNS      96     Standard query 0xf462 A weathermapdata.blob.core.windows.net

Frame 9: 96 bytes on wire (768 bits), 96 bytes captured (768 bits) on interface \Device\NPF_{1315F7C5-5EA1-43CA-9087-EF19375CCA6A}, id 0
Ethernet II, Src: AzureWav_fc:e2:73 (dc:f5:05:fc:e2:73), Dst: 1e:fd:96:3a:4d:31 (1e:fd:96:3a:4d:31)
Internet Protocol Version 4, Src: 192.168.69.39, Dst: 192.168.69.80
User Datagram Protocol, Src Port: 58163, Dst Port: 53
Domain Name System (query)

No.     Time           Source                Destination           Protocol Length Info
     10 7.978102       192.168.69.39         192.168.69.80         DNS      96     Standard query 0x8951 AAAA weathermapdata.blob.core.windows.net

Frame 10: 96 bytes on wire (768 bits), 96 bytes captured (768 bits) on interface \Device\NPF_{1315F7C5-5EA1-43CA-9087-EF19375CCA6A}, id 0
Ethernet II, Src: AzureWav_fc:e2:73 (dc:f5:05:fc:e2:73), Dst: 1e:fd:96:3a:4d:31 (1e:fd:96:3a:4d:31)
Internet Protocol Version 4, Src: 192.168.69.39, Dst: 192.168.69.80
User Datagram Protocol, Src Port: 49175, Dst Port: 53
Domain Name System (query)

No.     Time           Source                Destination           Protocol Length Info
     11 8.071272       192.168.69.80         192.168.69.39         DNS      152    Standard query response 0xf462 A weathermapdata.blob.core.windows.net CNAME blob.mwh03prdstf02a.store.core.windows.net A 20.60.228.1

Frame 11: 152 bytes on wire (1216 bits), 152 bytes captured (1216 bits) on interface \Device\NPF_{1315F7C5-5EA1-43CA-9087-EF19375CCA6A}, id 0
Ethernet II, Src: 1e:fd:96:3a:4d:31 (1e:fd:96:3a:4d:31), Dst: AzureWav_fc:e2:73 (dc:f5:05:fc:e2:73)
Internet Protocol Version 4, Src: 192.168.69.80, Dst: 192.168.69.39
User Datagram Protocol, Src Port: 53, Dst Port: 58163
Domain Name System (response)

No.     Time           Source                Destination           Protocol Length Info
     12 8.074149       192.168.69.80         192.168.69.39         DNS      222    Standard query response 0x8951 AAAA weathermapdata.blob.core.windows.net CNAME blob.mwh03prdstf02a.store.core.windows.net SOA ns1-05.azure-dns.com

Frame 12: 222 bytes on wire (1776 bits), 222 bytes captured (1776 bits) on interface \Device\NPF_{1315F7C5-5EA1-43CA-9087-EF19375CCA6A}, id 0
Ethernet II, Src: 1e:fd:96:3a:4d:31 (1e:fd:96:3a:4d:31), Dst: AzureWav_fc:e2:73 (dc:f5:05:fc:e2:73)
Internet Protocol Version 4, Src: 192.168.69.80, Dst: 192.168.69.39
User Datagram Protocol, Src Port: 53, Dst Port: 49175
Domain Name System (response)

No.     Time           Source                Destination           Protocol Length Info
     13 8.075179       192.168.69.39         20.60.228.1           TCP      66     53678 → 443 [SYN] Seq=0 Win=65535 Len=0 MSS=1460 WS=256 SACK_PERM

Frame 13: 66 bytes on wire (528 bits), 66 bytes captured (528 bits) on interface \Device\NPF_{1315F7C5-5EA1-43CA-9087-EF19375CCA6A}, id 0
Ethernet II, Src: AzureWav_fc:e2:73 (dc:f5:05:fc:e2:73), Dst: 1e:fd:96:3a:4d:31 (1e:fd:96:3a:4d:31)
Internet Protocol Version 4, Src: 192.168.69.39, Dst: 20.60.228.1
Transmission Control Protocol, Src Port: 53678, Dst Port: 443, Seq: 0, Len: 0

No.     Time           Source                Destination           Protocol Length Info
     14 8.369981       20.60.228.1           192.168.69.39         TCP      66     443 → 53678 [SYN, ACK] Seq=0 Ack=1 Win=65535 Len=0 MSS=1318 WS=256 SACK_PERM

Frame 14: 66 bytes on wire (528 bits), 66 bytes captured (528 bits) on interface \Device\NPF_{1315F7C5-5EA1-43CA-9087-EF19375CCA6A}, id 0
Ethernet II, Src: 1e:fd:96:3a:4d:31 (1e:fd:96:3a:4d:31), Dst: AzureWav_fc:e2:73 (dc:f5:05:fc:e2:73)
Internet Protocol Version 4, Src: 20.60.228.1, Dst: 192.168.69.39
Transmission Control Protocol, Src Port: 443, Dst Port: 53678, Seq: 0, Ack: 1, Len: 0

No.     Time           Source                Destination           Protocol Length Info
     15 8.370221       192.168.69.39         20.60.228.1           TCP      54     53678 → 443 [ACK] Seq=1 Ack=1 Win=262144 Len=0

Frame 15: 54 bytes on wire (432 bits), 54 bytes captured (432 bits) on interface \Device\NPF_{1315F7C5-5EA1-43CA-9087-EF19375CCA6A}, id 0
Ethernet II, Src: AzureWav_fc:e2:73 (dc:f5:05:fc:e2:73), Dst: 1e:fd:96:3a:4d:31 (1e:fd:96:3a:4d:31)
Internet Protocol Version 4, Src: 192.168.69.39, Dst: 20.60.228.1
Transmission Control Protocol, Src Port: 53678, Dst Port: 443, Seq: 1, Ack: 1, Len: 0

No.     Time           Source                Destination           Protocol Length Info
     16 8.373137       192.168.69.39         20.60.228.1           TLSv1.2  346    Client Hello

Frame 16: 346 bytes on wire (2768 bits), 346 bytes captured (2768 bits) on interface \Device\NPF_{1315F7C5-5EA1-43CA-9087-EF19375CCA6A}, id 0
Ethernet II, Src: AzureWav_fc:e2:73 (dc:f5:05:fc:e2:73), Dst: 1e:fd:96:3a:4d:31 (1e:fd:96:3a:4d:31)
Internet Protocol Version 4, Src: 192.168.69.39, Dst: 20.60.228.1
Transmission Control Protocol, Src Port: 53678, Dst Port: 443, Seq: 1, Ack: 1, Len: 292
Transport Layer Security

No.     Time           Source                Destination           Protocol Length Info
     17 8.706984       20.60.228.1           192.168.69.39         TCP      1372   443 → 53678 [ACK] Seq=1 Ack=293 Win=4194816 Len=1318 [TCP segment of a reassembled PDU]

Frame 17: 1372 bytes on wire (10976 bits), 1372 bytes captured (10976 bits) on interface \Device\NPF_{1315F7C5-5EA1-43CA-9087-EF19375CCA6A}, id 0
Ethernet II, Src: 1e:fd:96:3a:4d:31 (1e:fd:96:3a:4d:31), Dst: AzureWav_fc:e2:73 (dc:f5:05:fc:e2:73)
Internet Protocol Version 4, Src: 20.60.228.1, Dst: 192.168.69.39
Transmission Control Protocol, Src Port: 443, Dst Port: 53678, Seq: 1, Ack: 293, Len: 1318

No.     Time           Source                Destination           Protocol Length Info
     18 8.706984       20.60.228.1           192.168.69.39         TCP      1372   443 → 53678 [ACK] Seq=1319 Ack=293 Win=4194816 Len=1318 [TCP segment of a reassembled PDU]

Frame 18: 1372 bytes on wire (10976 bits), 1372 bytes captured (10976 bits) on interface \Device\NPF_{1315F7C5-5EA1-43CA-9087-EF19375CCA6A}, id 0
Ethernet II, Src: 1e:fd:96:3a:4d:31 (1e:fd:96:3a:4d:31), Dst: AzureWav_fc:e2:73 (dc:f5:05:fc:e2:73)
Internet Protocol Version 4, Src: 20.60.228.1, Dst: 192.168.69.39
Transmission Control Protocol, Src Port: 443, Dst Port: 53678, Seq: 1319, Ack: 293, Len: 1318

No.     Time           Source                Destination           Protocol Length Info
     19 8.706984       20.60.228.1           192.168.69.39         TCP      1372   443 → 53678 [ACK] Seq=2637 Ack=293 Win=4194816 Len=1318 [TCP segment of a reassembled PDU]

Frame 19: 1372 bytes on wire (10976 bits), 1372 bytes captured (10976 bits) on interface \Device\NPF_{1315F7C5-5EA1-43CA-9087-EF19375CCA6A}, id 0
Ethernet II, Src: 1e:fd:96:3a:4d:31 (1e:fd:96:3a:4d:31), Dst: AzureWav_fc:e2:73 (dc:f5:05:fc:e2:73)
Internet Protocol Version 4, Src: 20.60.228.1, Dst: 192.168.69.39
Transmission Control Protocol, Src Port: 443, Dst Port: 53678, Seq: 2637, Ack: 293, Len: 1318

No.     Time           Source                Destination           Protocol Length Info
     20 8.707213       192.168.69.39         20.60.228.1           TCP      54     53678 → 443 [ACK] Seq=293 Ack=3955 Win=262144 Len=0

Frame 20: 54 bytes on wire (432 bits), 54 bytes captured (432 bits) on interface \Device\NPF_{1315F7C5-5EA1-43CA-9087-EF19375CCA6A}, id 0
Ethernet II, Src: AzureWav_fc:e2:73 (dc:f5:05:fc:e2:73), Dst: 1e:fd:96:3a:4d:31 (1e:fd:96:3a:4d:31)
Internet Protocol Version 4, Src: 192.168.69.39, Dst: 20.60.228.1
Transmission Control Protocol, Src Port: 53678, Dst Port: 443, Seq: 293, Ack: 3955, Len: 0

No.     Time           Source                Destination           Protocol Length Info
     21 8.707956       20.60.228.1           192.168.69.39         TCP      1372   443 → 53678 [ACK] Seq=3955 Ack=293 Win=4194816 Len=1318 [TCP segment of a reassembled PDU]

Frame 21: 1372 bytes on wire (10976 bits), 1372 bytes captured (10976 bits) on interface \Device\NPF_{1315F7C5-5EA1-43CA-9087-EF19375CCA6A}, id 0
Ethernet II, Src: 1e:fd:96:3a:4d:31 (1e:fd:96:3a:4d:31), Dst: AzureWav_fc:e2:73 (dc:f5:05:fc:e2:73)
Internet Protocol Version 4, Src: 20.60.228.1, Dst: 192.168.69.39
Transmission Control Protocol, Src Port: 443, Dst Port: 53678, Seq: 3955, Ack: 293, Len: 1318

No.     Time           Source                Destination           Protocol Length Info
     22 8.707956       20.60.228.1           192.168.69.39         TCP      1372   443 → 53678 [ACK] Seq=5273 Ack=293 Win=4194816 Len=1318 [TCP segment of a reassembled PDU]

Frame 22: 1372 bytes on wire (10976 bits), 1372 bytes captured (10976 bits) on interface \Device\NPF_{1315F7C5-5EA1-43CA-9087-EF19375CCA6A}, id 0
Ethernet II, Src: 1e:fd:96:3a:4d:31 (1e:fd:96:3a:4d:31), Dst: AzureWav_fc:e2:73 (dc:f5:05:fc:e2:73)
Internet Protocol Version 4, Src: 20.60.228.1, Dst: 192.168.69.39
Transmission Control Protocol, Src Port: 443, Dst Port: 53678, Seq: 5273, Ack: 293, Len: 1318

No.     Time           Source                Destination           Protocol Length Info
     23 8.707956       20.60.228.1           192.168.69.39         TLSv1.2  929    Server Hello, Certificate, Certificate Status, Server Key Exchange, Server Hello Done

Frame 23: 929 bytes on wire (7432 bits), 929 bytes captured (7432 bits) on interface \Device\NPF_{1315F7C5-5EA1-43CA-9087-EF19375CCA6A}, id 0
Ethernet II, Src: 1e:fd:96:3a:4d:31 (1e:fd:96:3a:4d:31), Dst: AzureWav_fc:e2:73 (dc:f5:05:fc:e2:73)
Internet Protocol Version 4, Src: 20.60.228.1, Dst: 192.168.69.39
Transmission Control Protocol, Src Port: 443, Dst Port: 53678, Seq: 6591, Ack: 293, Len: 875
[6 Reassembled TCP Segments (7465 bytes): #17(1318), #18(1318), #19(1318), #21(1318), #22(1318), #23(875)]
Transport Layer Security

No.     Time           Source                Destination           Protocol Length Info
     24 8.708265       192.168.69.39         20.60.228.1           TCP      54     53678 → 443 [ACK] Seq=293 Ack=7466 Win=262144 Len=0

Frame 24: 54 bytes on wire (432 bits), 54 bytes captured (432 bits) on interface \Device\NPF_{1315F7C5-5EA1-43CA-9087-EF19375CCA6A}, id 0
Ethernet II, Src: AzureWav_fc:e2:73 (dc:f5:05:fc:e2:73), Dst: 1e:fd:96:3a:4d:31 (1e:fd:96:3a:4d:31)
Internet Protocol Version 4, Src: 192.168.69.39, Dst: 20.60.228.1
Transmission Control Protocol, Src Port: 53678, Dst Port: 443, Seq: 293, Ack: 7466, Len: 0

No.     Time           Source                Destination           Protocol Length Info
     25 8.754158       192.168.69.39         20.60.228.1           TLSv1.2  212    Client Key Exchange, Change Cipher Spec, Encrypted Handshake Message

Frame 25: 212 bytes on wire (1696 bits), 212 bytes captured (1696 bits) on interface \Device\NPF_{1315F7C5-5EA1-43CA-9087-EF19375CCA6A}, id 0
Ethernet II, Src: AzureWav_fc:e2:73 (dc:f5:05:fc:e2:73), Dst: 1e:fd:96:3a:4d:31 (1e:fd:96:3a:4d:31)
Internet Protocol Version 4, Src: 192.168.69.39, Dst: 20.60.228.1
Transmission Control Protocol, Src Port: 53678, Dst Port: 443, Seq: 293, Ack: 7466, Len: 158
Transport Layer Security

No.     Time           Source                Destination           Protocol Length Info
     26 8.754412       192.168.69.39         20.60.228.1           TLSv1.2  430    Application Data

Frame 26: 430 bytes on wire (3440 bits), 430 bytes captured (3440 bits) on interface \Device\NPF_{1315F7C5-5EA1-43CA-9087-EF19375CCA6A}, id 0
Ethernet II, Src: AzureWav_fc:e2:73 (dc:f5:05:fc:e2:73), Dst: 1e:fd:96:3a:4d:31 (1e:fd:96:3a:4d:31)
Internet Protocol Version 4, Src: 192.168.69.39, Dst: 20.60.228.1
Transmission Control Protocol, Src Port: 53678, Dst Port: 443, Seq: 451, Ack: 7466, Len: 376
Transport Layer Security

No.     Time           Source                Destination           Protocol Length Info
     27 9.142664       20.60.228.1           192.168.69.39         TCP      54     443 → 53678 [ACK] Seq=7466 Ack=827 Win=4194304 Len=0

Frame 27: 54 bytes on wire (432 bits), 54 bytes captured (432 bits) on interface \Device\NPF_{1315F7C5-5EA1-43CA-9087-EF19375CCA6A}, id 0
Ethernet II, Src: 1e:fd:96:3a:4d:31 (1e:fd:96:3a:4d:31), Dst: AzureWav_fc:e2:73 (dc:f5:05:fc:e2:73)
Internet Protocol Version 4, Src: 20.60.228.1, Dst: 192.168.69.39
Transmission Control Protocol, Src Port: 443, Dst Port: 53678, Seq: 7466, Ack: 827, Len: 0

No.     Time           Source                Destination           Protocol Length Info
     28 9.142664       20.60.228.1           192.168.69.39         TLSv1.2  105    Change Cipher Spec, Encrypted Handshake Message

Frame 28: 105 bytes on wire (840 bits), 105 bytes captured (840 bits) on interface \Device\NPF_{1315F7C5-5EA1-43CA-9087-EF19375CCA6A}, id 0
Ethernet II, Src: 1e:fd:96:3a:4d:31 (1e:fd:96:3a:4d:31), Dst: AzureWav_fc:e2:73 (dc:f5:05:fc:e2:73)
Internet Protocol Version 4, Src: 20.60.228.1, Dst: 192.168.69.39
Transmission Control Protocol, Src Port: 443, Dst Port: 53678, Seq: 7466, Ack: 827, Len: 51
Transport Layer Security

No.     Time           Source                Destination           Protocol Length Info
     29 9.142664       20.60.228.1           192.168.69.39         TCP      1372   443 → 53678 [ACK] Seq=7517 Ack=827 Win=4194304 Len=1318 [TCP segment of a reassembled PDU]

Frame 29: 1372 bytes on wire (10976 bits), 1372 bytes captured (10976 bits) on interface \Device\NPF_{1315F7C5-5EA1-43CA-9087-EF19375CCA6A}, id 0
Ethernet II, Src: 1e:fd:96:3a:4d:31 (1e:fd:96:3a:4d:31), Dst: AzureWav_fc:e2:73 (dc:f5:05:fc:e2:73)
Internet Protocol Version 4, Src: 20.60.228.1, Dst: 192.168.69.39
Transmission Control Protocol, Src Port: 443, Dst Port: 53678, Seq: 7517, Ack: 827, Len: 1318

No.     Time           Source                Destination           Protocol Length Info
     30 9.142664       20.60.228.1           192.168.69.39         TCP      1372   443 → 53678 [ACK] Seq=8835 Ack=827 Win=4194304 Len=1318 [TCP segment of a reassembled PDU]

Frame 30: 1372 bytes on wire (10976 bits), 1372 bytes captured (10976 bits) on interface \Device\NPF_{1315F7C5-5EA1-43CA-9087-EF19375CCA6A}, id 0
Ethernet II, Src: 1e:fd:96:3a:4d:31 (1e:fd:96:3a:4d:31), Dst: AzureWav_fc:e2:73 (dc:f5:05:fc:e2:73)
Internet Protocol Version 4, Src: 20.60.228.1, Dst: 192.168.69.39
Transmission Control Protocol, Src Port: 443, Dst Port: 53678, Seq: 8835, Ack: 827, Len: 1318

No.     Time           Source                Destination           Protocol Length Info
     31 9.142901       192.168.69.39         20.60.228.1           TCP      54     53678 → 443 [ACK] Seq=827 Ack=10153 Win=262144 Len=0

Frame 31: 54 bytes on wire (432 bits), 54 bytes captured (432 bits) on interface \Device\NPF_{1315F7C5-5EA1-43CA-9087-EF19375CCA6A}, id 0
Ethernet II, Src: AzureWav_fc:e2:73 (dc:f5:05:fc:e2:73), Dst: 1e:fd:96:3a:4d:31 (1e:fd:96:3a:4d:31)
Internet Protocol Version 4, Src: 192.168.69.39, Dst: 20.60.228.1
Transmission Control Protocol, Src Port: 53678, Dst Port: 443, Seq: 827, Ack: 10153, Len: 0

No.     Time           Source                Destination           Protocol Length Info
     32 9.178708       20.60.228.1           192.168.69.39         TCP      1372   443 → 53678 [ACK] Seq=10153 Ack=827 Win=4194304 Len=1318 [TCP segment of a reassembled PDU]

Frame 32: 1372 bytes on wire (10976 bits), 1372 bytes captured (10976 bits) on interface \Device\NPF_{1315F7C5-5EA1-43CA-9087-EF19375CCA6A}, id 0
Ethernet II, Src: 1e:fd:96:3a:4d:31 (1e:fd:96:3a:4d:31), Dst: AzureWav_fc:e2:73 (dc:f5:05:fc:e2:73)
Internet Protocol Version 4, Src: 20.60.228.1, Dst: 192.168.69.39
Transmission Control Protocol, Src Port: 443, Dst Port: 53678, Seq: 10153, Ack: 827, Len: 1318

No.     Time           Source                Destination           Protocol Length Info
     33 9.178708       20.60.228.1           192.168.69.39         TCP      1372   443 → 53678 [ACK] Seq=11471 Ack=827 Win=4194304 Len=1318 [TCP segment of a reassembled PDU]

Frame 33: 1372 bytes on wire (10976 bits), 1372 bytes captured (10976 bits) on interface \Device\NPF_{1315F7C5-5EA1-43CA-9087-EF19375CCA6A}, id 0
Ethernet II, Src: 1e:fd:96:3a:4d:31 (1e:fd:96:3a:4d:31), Dst: AzureWav_fc:e2:73 (dc:f5:05:fc:e2:73)
Internet Protocol Version 4, Src: 20.60.228.1, Dst: 192.168.69.39
Transmission Control Protocol, Src Port: 443, Dst Port: 53678, Seq: 11471, Ack: 827, Len: 1318

No.     Time           Source                Destination           Protocol Length Info
     34 9.178708       20.60.228.1           192.168.69.39         TLSv1.2  985    Application Data

Frame 34: 985 bytes on wire (7880 bits), 985 bytes captured (7880 bits) on interface \Device\NPF_{1315F7C5-5EA1-43CA-9087-EF19375CCA6A}, id 0
Ethernet II, Src: 1e:fd:96:3a:4d:31 (1e:fd:96:3a:4d:31), Dst: AzureWav_fc:e2:73 (dc:f5:05:fc:e2:73)
Internet Protocol Version 4, Src: 20.60.228.1, Dst: 192.168.69.39
Transmission Control Protocol, Src Port: 443, Dst Port: 53678, Seq: 12789, Ack: 827, Len: 931
[5 Reassembled TCP Segments (6203 bytes): #29(1318), #30(1318), #32(1318), #33(1318), #34(931)]
Transport Layer Security

No.     Time           Source                Destination           Protocol Length Info
     35 9.178923       192.168.69.39         20.60.228.1           TCP      54     53678 → 443 [ACK] Seq=827 Ack=13720 Win=262144 Len=0

Frame 35: 54 bytes on wire (432 bits), 54 bytes captured (432 bits) on interface \Device\NPF_{1315F7C5-5EA1-43CA-9087-EF19375CCA6A}, id 0
Ethernet II, Src: AzureWav_fc:e2:73 (dc:f5:05:fc:e2:73), Dst: 1e:fd:96:3a:4d:31 (1e:fd:96:3a:4d:31)
Internet Protocol Version 4, Src: 192.168.69.39, Dst: 20.60.228.1
Transmission Control Protocol, Src Port: 53678, Dst Port: 443, Seq: 827, Ack: 13720, Len: 0

No.     Time           Source                Destination           Protocol Length Info
     36 11.540685      52.87.52.189          192.168.69.39         TLSv1.2  85     Encrypted Alert

Frame 36: 85 bytes on wire (680 bits), 85 bytes captured (680 bits) on interface \Device\NPF_{1315F7C5-5EA1-43CA-9087-EF19375CCA6A}, id 0
Ethernet II, Src: 1e:fd:96:3a:4d:31 (1e:fd:96:3a:4d:31), Dst: AzureWav_fc:e2:73 (dc:f5:05:fc:e2:73)
Internet Protocol Version 4, Src: 52.87.52.189, Dst: 192.168.69.39
Transmission Control Protocol, Src Port: 443, Dst Port: 53670, Seq: 1, Ack: 1, Len: 31
Transport Layer Security

No.     Time           Source                Destination           Protocol Length Info
     37 11.540685      52.87.52.189          192.168.69.39         TCP      54     443 → 53670 [FIN, ACK] Seq=32 Ack=1 Win=185 Len=0

Frame 37: 54 bytes on wire (432 bits), 54 bytes captured (432 bits) on interface \Device\NPF_{1315F7C5-5EA1-43CA-9087-EF19375CCA6A}, id 0
Ethernet II, Src: 1e:fd:96:3a:4d:31 (1e:fd:96:3a:4d:31), Dst: AzureWav_fc:e2:73 (dc:f5:05:fc:e2:73)
Internet Protocol Version 4, Src: 52.87.52.189, Dst: 192.168.69.39
Transmission Control Protocol, Src Port: 443, Dst Port: 53670, Seq: 32, Ack: 1, Len: 0

No.     Time           Source                Destination           Protocol Length Info
     38 11.540886      192.168.69.39         52.87.52.189          TCP      54     53670 → 443 [ACK] Seq=1 Ack=33 Win=255 Len=0

Frame 38: 54 bytes on wire (432 bits), 54 bytes captured (432 bits) on interface \Device\NPF_{1315F7C5-5EA1-43CA-9087-EF19375CCA6A}, id 0
Ethernet II, Src: AzureWav_fc:e2:73 (dc:f5:05:fc:e2:73), Dst: 1e:fd:96:3a:4d:31 (1e:fd:96:3a:4d:31)
Internet Protocol Version 4, Src: 192.168.69.39, Dst: 52.87.52.189
Transmission Control Protocol, Src Port: 53670, Dst Port: 443, Seq: 1, Ack: 33, Len: 0

No.     Time           Source                Destination           Protocol Length Info
     39 13.109584      1e:fd:96:3a:4d:31     AzureWav_fc:e2:73     ARP      42     Who has 192.168.69.39? Tell 192.168.69.80

Frame 39: 42 bytes on wire (336 bits), 42 bytes captured (336 bits) on interface \Device\NPF_{1315F7C5-5EA1-43CA-9087-EF19375CCA6A}, id 0
Ethernet II, Src: 1e:fd:96:3a:4d:31 (1e:fd:96:3a:4d:31), Dst: AzureWav_fc:e2:73 (dc:f5:05:fc:e2:73)
Address Resolution Protocol (request)

No.     Time           Source                Destination           Protocol Length Info
     40 13.109635      AzureWav_fc:e2:73     1e:fd:96:3a:4d:31     ARP      42     192.168.69.39 is at dc:f5:05:fc:e2:73

Frame 40: 42 bytes on wire (336 bits), 42 bytes captured (336 bits) on interface \Device\NPF_{1315F7C5-5EA1-43CA-9087-EF19375CCA6A}, id 0
Ethernet II, Src: AzureWav_fc:e2:73 (dc:f5:05:fc:e2:73), Dst: 1e:fd:96:3a:4d:31 (1e:fd:96:3a:4d:31)
Address Resolution Protocol (reply)

No.     Time           Source                Destination           Protocol Length Info
     41 14.639493      192.168.69.39         104.208.16.88         TCP      54     53669 → 443 [FIN, ACK] Seq=1 Ack=1 Win=1019 Len=0

Frame 41: 54 bytes on wire (432 bits), 54 bytes captured (432 bits) on interface \Device\NPF_{1315F7C5-5EA1-43CA-9087-EF19375CCA6A}, id 0
Ethernet II, Src: AzureWav_fc:e2:73 (dc:f5:05:fc:e2:73), Dst: 1e:fd:96:3a:4d:31 (1e:fd:96:3a:4d:31)
Internet Protocol Version 4, Src: 192.168.69.39, Dst: 104.208.16.88
Transmission Control Protocol, Src Port: 53669, Dst Port: 443, Seq: 1, Ack: 1, Len: 0

No.     Time           Source                Destination           Protocol Length Info
     42 15.799634      192.168.69.39         104.208.16.88         TCP      54     [TCP Retransmission] 53669 → 443 [FIN, ACK] Seq=1 Ack=1 Win=1019 Len=0

Frame 42: 54 bytes on wire (432 bits), 54 bytes captured (432 bits) on interface \Device\NPF_{1315F7C5-5EA1-43CA-9087-EF19375CCA6A}, id 0
Ethernet II, Src: AzureWav_fc:e2:73 (dc:f5:05:fc:e2:73), Dst: 1e:fd:96:3a:4d:31 (1e:fd:96:3a:4d:31)
Internet Protocol Version 4, Src: 192.168.69.39, Dst: 104.208.16.88
Transmission Control Protocol, Src Port: 53669, Dst Port: 443, Seq: 1, Ack: 1, Len: 0

No.     Time           Source                Destination           Protocol Length Info
     43 15.840440      104.208.16.88         192.168.69.39         TCP      54     443 → 53669 [FIN, ACK] Seq=1 Ack=2 Win=2045 Len=0

Frame 43: 54 bytes on wire (432 bits), 54 bytes captured (432 bits) on interface \Device\NPF_{1315F7C5-5EA1-43CA-9087-EF19375CCA6A}, id 0
Ethernet II, Src: 1e:fd:96:3a:4d:31 (1e:fd:96:3a:4d:31), Dst: AzureWav_fc:e2:73 (dc:f5:05:fc:e2:73)
Internet Protocol Version 4, Src: 104.208.16.88, Dst: 192.168.69.39
Transmission Control Protocol, Src Port: 443, Dst Port: 53669, Seq: 1, Ack: 2, Len: 0

No.     Time           Source                Destination           Protocol Length Info
     44 15.840574      192.168.69.39         104.208.16.88         TCP      54     53669 → 443 [ACK] Seq=2 Ack=2 Win=1019 Len=0

Frame 44: 54 bytes on wire (432 bits), 54 bytes captured (432 bits) on interface \Device\NPF_{1315F7C5-5EA1-43CA-9087-EF19375CCA6A}, id 0
Ethernet II, Src: AzureWav_fc:e2:73 (dc:f5:05:fc:e2:73), Dst: 1e:fd:96:3a:4d:31 (1e:fd:96:3a:4d:31)
Internet Protocol Version 4, Src: 192.168.69.39, Dst: 104.208.16.88
Transmission Control Protocol, Src Port: 53669, Dst Port: 443, Seq: 2, Ack: 2, Len: 0

No.     Time           Source                Destination           Protocol Length Info
     45 16.181341      104.208.16.88         192.168.69.39         TCP      54     [TCP Dup ACK 43#1] 443 → 53669 [ACK] Seq=2 Ack=2 Win=2045 Len=0

Frame 45: 54 bytes on wire (432 bits), 54 bytes captured (432 bits) on interface \Device\NPF_{1315F7C5-5EA1-43CA-9087-EF19375CCA6A}, id 0
Ethernet II, Src: 1e:fd:96:3a:4d:31 (1e:fd:96:3a:4d:31), Dst: AzureWav_fc:e2:73 (dc:f5:05:fc:e2:73)
Internet Protocol Version 4, Src: 104.208.16.88, Dst: 192.168.69.39
Transmission Control Protocol, Src Port: 443, Dst Port: 53669, Seq: 2, Ack: 2, Len: 0

No.     Time           Source                Destination           Protocol Length Info
     46 19.875098      2620:1ec:c11::239     2401:4900:598a:b192:7cf7:cce2:285f:3518 TCP      74     443 → 53666 [RST, ACK] Seq=1 Ack=1 Win=0 Len=0

Frame 46: 74 bytes on wire (592 bits), 74 bytes captured (592 bits) on interface \Device\NPF_{1315F7C5-5EA1-43CA-9087-EF19375CCA6A}, id 0
Ethernet II, Src: 1e:fd:96:3a:4d:31 (1e:fd:96:3a:4d:31), Dst: AzureWav_fc:e2:73 (dc:f5:05:fc:e2:73)
Internet Protocol Version 6, Src: 2620:1ec:c11::239, Dst: 2401:4900:598a:b192:7cf7:cce2:285f:3518
Transmission Control Protocol, Src Port: 443, Dst Port: 53666, Seq: 1, Ack: 1, Len: 0

No.     Time           Source                Destination           Protocol Length Info
     47 20.697648      AzureWav_fc:e2:73     1e:fd:96:3a:4d:31     ARP      42     Who has 192.168.69.80? Tell 192.168.69.39

Frame 47: 42 bytes on wire (336 bits), 42 bytes captured (336 bits) on interface \Device\NPF_{1315F7C5-5EA1-43CA-9087-EF19375CCA6A}, id 0
Ethernet II, Src: AzureWav_fc:e2:73 (dc:f5:05:fc:e2:73), Dst: 1e:fd:96:3a:4d:31 (1e:fd:96:3a:4d:31)
Address Resolution Protocol (request)

No.     Time           Source                Destination           Protocol Length Info
     48 20.701537      1e:fd:96:3a:4d:31     AzureWav_fc:e2:73     ARP      42     192.168.69.80 is at 1e:fd:96:3a:4d:31

Frame 48: 42 bytes on wire (336 bits), 42 bytes captured (336 bits) on interface \Device\NPF_{1315F7C5-5EA1-43CA-9087-EF19375CCA6A}, id 0
Ethernet II, Src: 1e:fd:96:3a:4d:31 (1e:fd:96:3a:4d:31), Dst: AzureWav_fc:e2:73 (dc:f5:05:fc:e2:73)
Address Resolution Protocol (reply)

No.     Time           Source                Destination           Protocol Length Info
     49 20.979825      2401:4900:598a:b192:7cf7:cce2:285f:3518 2404:6800:4003:c05::bc TCP      75     53391 → 5228 [ACK] Seq=1 Ack=1 Win=254 Len=1

Frame 49: 75 bytes on wire (600 bits), 75 bytes captured (600 bits) on interface \Device\NPF_{1315F7C5-5EA1-43CA-9087-EF19375CCA6A}, id 0
Ethernet II, Src: AzureWav_fc:e2:73 (dc:f5:05:fc:e2:73), Dst: 1e:fd:96:3a:4d:31 (1e:fd:96:3a:4d:31)
Internet Protocol Version 6, Src: 2401:4900:598a:b192:7cf7:cce2:285f:3518, Dst: 2404:6800:4003:c05::bc
Transmission Control Protocol, Src Port: 53391, Dst Port: 5228, Seq: 1, Ack: 1, Len: 1
Data (1 byte)

0000  00                                                .

No.     Time           Source                Destination           Protocol Length Info
     50 21.122965      2404:6800:4003:c05::bc 2401:4900:598a:b192:7cf7:cce2:285f:3518 TCP      86     5228 → 53391 [ACK] Seq=1 Ack=2 Win=265 Len=0 SLE=1 SRE=2

Frame 50: 86 bytes on wire (688 bits), 86 bytes captured (688 bits) on interface \Device\NPF_{1315F7C5-5EA1-43CA-9087-EF19375CCA6A}, id 0
Ethernet II, Src: 1e:fd:96:3a:4d:31 (1e:fd:96:3a:4d:31), Dst: AzureWav_fc:e2:73 (dc:f5:05:fc:e2:73)
Internet Protocol Version 6, Src: 2404:6800:4003:c05::bc, Dst: 2401:4900:598a:b192:7cf7:cce2:285f:3518
Transmission Control Protocol, Src Port: 5228, Dst Port: 53391, Seq: 1, Ack: 2, Len: 0

No.     Time           Source                Destination           Protocol Length Info
     51 22.165425      192.168.69.39         52.184.81.210         TCP      54     53677 → 443 [RST, ACK] Seq=1 Ack=1 Win=0 Len=0

Frame 51: 54 bytes on wire (432 bits), 54 bytes captured (432 bits) on interface \Device\NPF_{1315F7C5-5EA1-43CA-9087-EF19375CCA6A}, id 0
Ethernet II, Src: AzureWav_fc:e2:73 (dc:f5:05:fc:e2:73), Dst: 1e:fd:96:3a:4d:31 (1e:fd:96:3a:4d:31)
Internet Protocol Version 4, Src: 192.168.69.39, Dst: 52.184.81.210
Transmission Control Protocol, Src Port: 53677, Dst Port: 443, Seq: 1, Ack: 1, Len: 0

No.     Time           Source                Destination           Protocol Length Info
     52 24.304944      2401:4900:598a:b192:7cf7:cce2:285f:3518 2406:da1a:c68:9c00:e364:8e91:c513:d764 TLSv1.2  112    Application Data

Frame 52: 112 bytes on wire (896 bits), 112 bytes captured (896 bits) on interface \Device\NPF_{1315F7C5-5EA1-43CA-9087-EF19375CCA6A}, id 0
Ethernet II, Src: AzureWav_fc:e2:73 (dc:f5:05:fc:e2:73), Dst: 1e:fd:96:3a:4d:31 (1e:fd:96:3a:4d:31)
Internet Protocol Version 6, Src: 2401:4900:598a:b192:7cf7:cce2:285f:3518, Dst: 2406:da1a:c68:9c00:e364:8e91:c513:d764
Transmission Control Protocol, Src Port: 53642, Dst Port: 443, Seq: 1, Ack: 1, Len: 38
Transport Layer Security

No.     Time           Source                Destination           Protocol Length Info
     53 24.395185      2406:da1a:c68:9c00:e364:8e91:c513:d764 2401:4900:598a:b192:7cf7:cce2:285f:3518 TLSv1.2  106    Application Data

Frame 53: 106 bytes on wire (848 bits), 106 bytes captured (848 bits) on interface \Device\NPF_{1315F7C5-5EA1-43CA-9087-EF19375CCA6A}, id 0
Ethernet II, Src: 1e:fd:96:3a:4d:31 (1e:fd:96:3a:4d:31), Dst: AzureWav_fc:e2:73 (dc:f5:05:fc:e2:73)
Internet Protocol Version 6, Src: 2406:da1a:c68:9c00:e364:8e91:c513:d764, Dst: 2401:4900:598a:b192:7cf7:cce2:285f:3518
Transmission Control Protocol, Src Port: 443, Dst Port: 53642, Seq: 1, Ack: 39, Len: 32
Transport Layer Security

No.     Time           Source                Destination           Protocol Length Info
     54 24.446351      2401:4900:598a:b192:7cf7:cce2:285f:3518 2406:da1a:c68:9c00:e364:8e91:c513:d764 TCP      74     53642 → 443 [ACK] Seq=39 Ack=33 Win=257 Len=0

Frame 54: 74 bytes on wire (592 bits), 74 bytes captured (592 bits) on interface \Device\NPF_{1315F7C5-5EA1-43CA-9087-EF19375CCA6A}, id 0
Ethernet II, Src: AzureWav_fc:e2:73 (dc:f5:05:fc:e2:73), Dst: 1e:fd:96:3a:4d:31 (1e:fd:96:3a:4d:31)
Internet Protocol Version 6, Src: 2401:4900:598a:b192:7cf7:cce2:285f:3518, Dst: 2406:da1a:c68:9c00:e364:8e91:c513:d764
Transmission Control Protocol, Src Port: 53642, Dst Port: 443, Seq: 39, Ack: 33, Len: 0

No.     Time           Source                Destination           Protocol Length Info
     55 26.420604      2620:1ec:c11::200     2401:4900:598a:b192:7cf7:cce2:285f:3518 TCP      74     443 → 53667 [RST, ACK] Seq=1 Ack=1 Win=0 Len=0

Frame 55: 74 bytes on wire (592 bits), 74 bytes captured (592 bits) on interface \Device\NPF_{1315F7C5-5EA1-43CA-9087-EF19375CCA6A}, id 0
Ethernet II, Src: 1e:fd:96:3a:4d:31 (1e:fd:96:3a:4d:31), Dst: AzureWav_fc:e2:73 (dc:f5:05:fc:e2:73)
Internet Protocol Version 6, Src: 2620:1ec:c11::200, Dst: 2401:4900:598a:b192:7cf7:cce2:285f:3518
Transmission Control Protocol, Src Port: 443, Dst Port: 53667, Seq: 1, Ack: 1, Len: 0

No.     Time           Source                Destination           Protocol Length Info
     56 29.430373      fe80::1cfd:96ff:fe3a:4d31 2401:4900:598a:b192:7cf7:cce2:285f:3518 ICMPv6   86     Neighbor Solicitation for 2401:4900:598a:b192:7cf7:cce2:285f:3518 from 1e:fd:96:3a:4d:31

Frame 56: 86 bytes on wire (688 bits), 86 bytes captured (688 bits) on interface \Device\NPF_{1315F7C5-5EA1-43CA-9087-EF19375CCA6A}, id 0
Ethernet II, Src: 1e:fd:96:3a:4d:31 (1e:fd:96:3a:4d:31), Dst: AzureWav_fc:e2:73 (dc:f5:05:fc:e2:73)
Internet Protocol Version 6, Src: fe80::1cfd:96ff:fe3a:4d31, Dst: 2401:4900:598a:b192:7cf7:cce2:285f:3518
Internet Control Message Protocol v6

No.     Time           Source                Destination           Protocol Length Info
     57 29.430497      2401:4900:598a:b192:7cf7:cce2:285f:3518 fe80::1cfd:96ff:fe3a:4d31 ICMPv6   86     Neighbor Advertisement 2401:4900:598a:b192:7cf7:cce2:285f:3518 (sol, ovr) is at dc:f5:05:fc:e2:73

Frame 57: 86 bytes on wire (688 bits), 86 bytes captured (688 bits) on interface \Device\NPF_{1315F7C5-5EA1-43CA-9087-EF19375CCA6A}, id 0
Ethernet II, Src: AzureWav_fc:e2:73 (dc:f5:05:fc:e2:73), Dst: 1e:fd:96:3a:4d:31 (1e:fd:96:3a:4d:31)
Internet Protocol Version 6, Src: 2401:4900:598a:b192:7cf7:cce2:285f:3518, Dst: fe80::1cfd:96ff:fe3a:4d31
Internet Control Message Protocol v6

No.     Time           Source                Destination           Protocol Length Info
     58 37.090507      192.168.69.39         192.168.69.255        NBNS     92     Name query NB LAPTOP-K91LS1U6<1c>

Frame 58: 92 bytes on wire (736 bits), 92 bytes captured (736 bits) on interface \Device\NPF_{1315F7C5-5EA1-43CA-9087-EF19375CCA6A}, id 0
Ethernet II, Src: AzureWav_fc:e2:73 (dc:f5:05:fc:e2:73), Dst: Broadcast (ff:ff:ff:ff:ff:ff)
Internet Protocol Version 4, Src: 192.168.69.39, Dst: 192.168.69.255
User Datagram Protocol, Src Port: 137, Dst Port: 137
NetBIOS Name Service

No.     Time           Source                Destination           Protocol Length Info
     59 37.840787      192.168.69.39         192.168.69.255        NBNS     92     Name query NB LAPTOP-K91LS1U6<1c>

Frame 59: 92 bytes on wire (736 bits), 92 bytes captured (736 bits) on interface \Device\NPF_{1315F7C5-5EA1-43CA-9087-EF19375CCA6A}, id 0
Ethernet II, Src: AzureWav_fc:e2:73 (dc:f5:05:fc:e2:73), Dst: Broadcast (ff:ff:ff:ff:ff:ff)
Internet Protocol Version 4, Src: 192.168.69.39, Dst: 192.168.69.255
User Datagram Protocol, Src Port: 137, Dst Port: 137
NetBIOS Name Service

No.     Time           Source                Destination           Protocol Length Info
     60 38.605125      192.168.69.39         192.168.69.255        NBNS     92     Name query NB LAPTOP-K91LS1U6<1c>

Frame 60: 92 bytes on wire (736 bits), 92 bytes captured (736 bits) on interface \Device\NPF_{1315F7C5-5EA1-43CA-9087-EF19375CCA6A}, id 0
Ethernet II, Src: AzureWav_fc:e2:73 (dc:f5:05:fc:e2:73), Dst: Broadcast (ff:ff:ff:ff:ff:ff)
Internet Protocol Version 4, Src: 192.168.69.39, Dst: 192.168.69.255
User Datagram Protocol, Src Port: 137, Dst Port: 137
NetBIOS Name Service

No.     Time           Source                Destination           Protocol Length Info
     61 43.748661      192.168.69.39         35.174.127.31         TCP      55     53397 → 443 [ACK] Seq=1 Ack=1 Win=252 Len=1 [TCP segment of a reassembled PDU]

Frame 61: 55 bytes on wire (440 bits), 55 bytes captured (440 bits) on interface \Device\NPF_{1315F7C5-5EA1-43CA-9087-EF19375CCA6A}, id 0
Ethernet II, Src: AzureWav_fc:e2:73 (dc:f5:05:fc:e2:73), Dst: 1e:fd:96:3a:4d:31 (1e:fd:96:3a:4d:31)
Internet Protocol Version 4, Src: 192.168.69.39, Dst: 35.174.127.31
Transmission Control Protocol, Src Port: 53397, Dst Port: 443, Seq: 1, Ack: 1, Len: 1

No.     Time           Source                Destination           Protocol Length Info
     62 44.189240      35.174.127.31         192.168.69.39         TCP      66     443 → 53397 [ACK] Seq=1 Ack=2 Win=391 Len=0 SLE=1 SRE=2

Frame 62: 66 bytes on wire (528 bits), 66 bytes captured (528 bits) on interface \Device\NPF_{1315F7C5-5EA1-43CA-9087-EF19375CCA6A}, id 0
Ethernet II, Src: 1e:fd:96:3a:4d:31 (1e:fd:96:3a:4d:31), Dst: AzureWav_fc:e2:73 (dc:f5:05:fc:e2:73)
Internet Protocol Version 4, Src: 35.174.127.31, Dst: 192.168.69.39
Transmission Control Protocol, Src Port: 443, Dst Port: 53397, Seq: 1, Ack: 2, Len: 0

No.     Time           Source                Destination           Protocol Length Info
     63 44.303782      192.168.69.39         35.174.127.31         TLSv1.2  301    Ignored Unknown Record

